b'id',b'created_at',b'retweet_count',b'text'
720210747037466624,2016-04-13 11:23:17,38,b'How the Verizon strike could affect your service https://t.co/kTXi2ENku3 https://t.co/Qgc3IwGOk0'
720210442300309504,2016-04-13 11:22:04,6,"b""Patents didn't give us the malaria vaccine. Can they deliver the technology to fight climate change? https://t.co/MD6tBuePcG"""
720209258810372097,2016-04-13 11:17:22,9,b'RT @portereduardo: Will patents slow the spread of new technology to combat climate change? https://t.co/s1LtbMg3e6'
720206910322921472,2016-04-13 11:08:02,5,b'3 countries account for more than three-quarters of the global farmland dedicated to genetically modified crops https://t.co/azlwDRUxZR'
720204498753425408,2016-04-13 10:58:27,8,b'Thousands of Verizon workers went on strike this morning https://t.co/UI7EgC2eHD https://t.co/mpNExiXngB'
720200881782800384,2016-04-13 10:44:05,2,b'RT @markscott82: So I get the use of bots for info on train times &amp; the like. But am I really going to use them to buy shoes? https://t.co/\xe2\x80\xa6'
720197612452896768,2016-04-13 10:31:06,17,b'Google\xe2\x80\x99s calendar can now identify spare time and fill it up for you with things like exercise or \xe2\x80\x9cme time\xe2\x80\x9d https://t.co/o5DbrL1zV2'
720193835532435457,2016-04-13 10:16:05,78,b'RT @nytimes: How to earn airline miles and points without ever leaving home https://t.co/uKGMygO0mE'
720190060004536320,2016-04-13 10:01:05,7,b'The Facebook and Napster pioneer Sean Parker wants to invest in a new field: cancer immunotherapy. https://t.co/tI4SRVIH2G'
720186738921054208,2016-04-13 09:47:53,5,"b'RT @Chadbray: Financial Conduct Authority suggests potential reforms for I.P.O. process in Britain, publishing prospectus earlier. https://\xe2\x80\xa6'"
720185778383548416,2016-04-13 09:44:04,10,b'RT @Jeffrey_Cane: Rise of institutional investors and their cross-ownership prompts competition worries. via @StevenDavidoff https://t.co/k\xe2\x80\xa6'
720182500690149376,2016-04-13 09:31:03,4,b'Hollywood discovers that it may be missing out on date night https://t.co/G4snAXp9SR'
720178725342601216,2016-04-13 09:16:03,160,"b'RT @nytimes: Thieves made off with only 7 of 10 Warhol prints, devaluing whatever profits they would hope to make off the heist https://t.c\xe2\x80\xa6'"
720174707648172032,2016-04-13 09:00:05,10,b'The U.S. coal giant Peabody Energy has filed for bankruptcy protection https://t.co/c9iMflN5Jl https://t.co/AjyvKx3UOs'
720170670211080192,2016-04-13 08:44:02,26,"b'RT @markscott82: Ahead of #PrivacyShield announcement this afternoon, here\xe2\x80\x99s how your privacy rights differ in Europe vs US - https://t.co/\xe2\x80\xa6'"
720167407222964224,2016-04-13 08:31:04,13,b'The old Ford was an automaker. The new Ford wants to be a tech firm. https://t.co/KfZ50lPmmC https://t.co/PsUKeAgxw7'
720161366179450880,2016-04-13 08:07:04,14,"b'For the first time in 20 years, farmers used less land for genetically modified crops https://t.co/WIwDmPdd4S https://t.co/JbOQ8T2BUT'"
720157090342445056,2016-04-13 07:50:04,5,"b""Here is a tech firm's modern HQ plans (but the company is not in California): https://t.co/m1KGqHyMzN https://t.co/B9Cc4p5dlQ"""
720116390066262018,2016-04-13 05:08:21,31,"b'For the first time, the amount of farmland for genetically modified crops went down in 2015 https://t.co/JdCPJDKuWn https://t.co/uc3QEVomM0'"
720096315884052480,2016-04-13 03:48:35,9,"b'RT @vindugoel: Facebook enters the Bot Wars, with Messenger as its weapon, reports @mikeisaac https://t.co/OpZDyLzwxS'"
720090908012756992,2016-04-13 03:27:05,21,"b'Deutsche Bank freezes North Carolina expansion, in protest of bias law https://t.co/ne2AFces3f https://t.co/AHlUY0R5qv'"
720085246545408000,2016-04-13 03:04:35,4,b'Activists Push to Continue a Libel Suit Against Them https://t.co/a61lppfH98 https://t.co/SiQOwXVjlT'
720080072506503168,2016-04-13 02:44:02,10,"b""It's not divesting but Yale says its endowment makes progress on climate change https://t.co/DYqeV7UfWz https://t.co/04lh6Zj9iP"""
720077805799763968,2016-04-13 02:35:01,4,b'Freeing lonely iPad apps from almost empty folders https://t.co/wQYDSiYtRd https://t.co/z1b757vCKM'
720076806666199040,2016-04-13 02:31:03,6,b'Questions raised about the power of Vanguard and other big institutions https://t.co/auPiRdPtqC https://t.co/5Zohw8u8mh'
720073301603794945,2016-04-13 02:17:08,8,b'Thoughts on bots by @MikeIsaac: https://t.co/tUZQ3A7mnI'
720069057031061504,2016-04-13 02:00:16,5,"b'Puerto Rico\xe2\x80\x99s D.C. power couple: \xe2\x80\x9cUnfortunately, it is par for the course when it comes to the political elite.\xe2\x80\x9d https://t.co/Q5nrN4Bxfe'"
720065732533493760,2016-04-13 01:47:03,9,"b""European Union proposes rules to shine a light on multinational companies' tax arrangements. https://t.co/mhqOQNqvjR https://t.co/EYEUUSPBwf"""
720061707394093056,2016-04-13 01:31:03,4,b'Chatting with Bots on Facebook to communicate what you want:  https://t.co/HR0IKzUdj5'
720059199384920064,2016-04-13 01:21:05,4,b'How do we encourage zero-carbon energy tech to spread around the world? https://t.co/nvAiw29MGE https://t.co/Zgs2qZ7G1V'
720056415038124033,2016-04-13 01:10:02,2,"b""Patents didn't give us the malaria vaccine. Can they deliver the technology to fight climate change? https://t.co/Y3tHOiZVVt"""
720053932886736896,2016-04-13 01:00:10,2,"b'Donald Trump likes to vilify the media. In New York, he has a long history of embracing it. https://t.co/kIcwVp8PJf'"
720052656530714626,2016-04-13 00:55:05,4,b'How do we encourage zero-carbon energy tech to spread around the world? https://t.co/YEBNTPACY5 https://t.co/sbGQTSlL3w'
720045609076551680,2016-04-13 00:27:05,10,"b'Donald Trump likes to vilify the media. In New York, he has a long history of embracing it. https://t.co/z8BWDLZxK3'"
720042071512510464,2016-04-13 00:13:02,4,"b'If Virgin America is ""a young, hip airline"" some see Alaska Air as ""a friendly aunt.\xe2\x80\x9d https://t.co/NaKrHFm76c https://t.co/16TKcrMmEK'"
720039567559102466,2016-04-13 00:03:05,10,b'Al Jazeera America ends its run https://t.co/nDGCvOAJvn https://t.co/9QVxkEzmPb'
720035531195879424,2016-04-12 23:47:02,12,"b""Puerto Rico's rep. has introduced legislation that could help firms that have hired his wife https://t.co/ldWuWWWwXL https://t.co/vZx0ZObAbi"""
720032533627412480,2016-04-12 23:35:08,22,b'Unsealed documents undercut the U.S. case for taking Fannie Mae profits https://t.co/1AkANN6VaM https://t.co/gfiMFElQyc'
720028743859834880,2016-04-12 23:20:04,3,b'Chatting with Bots on Facebook to get what you want:  https://t.co/N62vvF8ZgC'
720025718479056896,2016-04-12 23:08:03,12,b'The last day of Al Jazeera America https://t.co/XjJkhuH9Yv https://t.co/zmXLzmmY96'
720020445458771968,2016-04-12 22:47:06,7,"b""Goldman's stock is 4% below  its level of five and 10 years ago https://t.co/E3C8jfWQuT"""
720015391221788672,2016-04-12 22:27:01,8,"b'Deutsche Bank freezes North Carolina expansion, in protest of bias law https://t.co/bsFnxvhEDd https://t.co/YBtkwhqEZT'"
720013132127739908,2016-04-12 22:18:02,1,"b'The robo-adviser Betterment is adding an ex-Charles Schwab executive, John S. Clendening, to its board https://t.co/ST3Vhto0iO'"
720010620289081345,2016-04-12 22:08:03,5,b'I.M.F. forecasts slow growth in developing nations https://t.co/DcYAXACku7 https://t.co/I7pZW32FfR'
720009371808370690,2016-04-12 22:03:06,6,"b'For a generalist, \xe2\x80\x9ctoo big to fail\xe2\x80\x9d may be too tricky to judge https://t.co/V0xGFkLYiw https://t.co/VIr4ks81zA'"
720006597586657281,2016-04-12 21:52:04,19,"b""European Union proposes rules to shine a light on multinational companies' tax arrangements. https://t.co/IS88ELoBaE https://t.co/LRReBPe3iD"""
720003583509442560,2016-04-12 21:40:05,8,"b'If Virgin America is ""a young, hip airline"" some see Alaska Air as ""a friendly aunt.\xe2\x80\x9d https://t.co/0lOuyJUejB https://t.co/pHTJjXImi4'"
719999803321630720,2016-04-12 21:25:04,4,b'It may take a little longer on the Sumner Redstone suit https://t.co/AaHeB7Jsbx'
719996588731588609,2016-04-12 21:12:18,12,b'Yale makes progress in shaping its endowment to address climate change https://t.co/78QZif2xE5 https://t.co/8eBcyUMZt0'
719992597012418560,2016-04-12 20:56:26,6,b'Freeing lonely iPad apps from almost empty folders https://t.co/KYkR01aptf'
719990926807052288,2016-04-12 20:49:48,44,"b""RT @EricLiptonNYT: Economic Crisis in Puerto Rico has been good financial for someone: Family of Puerto Rico's only Member of Congress. htt\xe2\x80\xa6"""
719987218866159616,2016-04-12 20:35:04,23,b'Unsealed documents undercut the U.S. case for taking Fannie Mae profits https://t.co/SAaOrfJnRo https://t.co/cdHludwL81'
719981944017199104,2016-04-12 20:14:06,8,b'Alan Dershowitz and 2 other lawyers settle suit and counter claim https://t.co/ukKbJkXWod https://t.co/gZ3qewGGul'
719979580719788033,2016-04-12 20:04:43,6,"b'For Indian start-ups, tenacity beats high tech https://t.co/DGiwW1ns3h https://t.co/RHPeAyptCJ'"
719976390704164864,2016-04-12 19:52:02,9,"b""European Union proposes rules to shine a light on multinational companies' tax arrangements. https://t.co/YEt8fpbvI5 https://t.co/GwWVAaFqhV"""
719971954887888898,2016-04-12 19:34:25,5,b'Can Congress and the government come up with new laws to control the prison population? https://t.co/bHY3aTFPMD https://t.co/B6Hdtj4Npj'
719970115920519170,2016-04-12 19:27:06,6,"b'Deutsche Bank freezes North Carolina expansion, in protest of bias law https://t.co/Kmhq6h1pkq https://t.co/lTtyKNI33R'"
719967090799722496,2016-04-12 19:15:05,9,b'I.M.F. forecasts slow growth in developing nations https://t.co/oS8gVv44vB https://t.co/9euUfsqow6'
719965843111735296,2016-04-12 19:10:07,4,"b""Patents didn't give us the malaria vaccine. Can they deliver the technology to fight climate change? https://t.co/a2gK5kFADs"""
719964063774740481,2016-04-12 19:03:03,8,"b'For a generalist, \xe2\x80\x9ctoo big to fail\xe2\x80\x9d may be too tricky to judge https://t.co/xG3LMTuNTH https://t.co/HGzLR3hSMS'"
719963428333436928,2016-04-12 19:00:32,5,"b'Puerto Rico\xe2\x80\x99s D.C. power couple: \xe2\x80\x9cUnfortunately, it is par for the course when it comes to the political elite.\xe2\x80\x9d https://t.co/2b04KVbAQI'"
719958174065913856,2016-04-12 18:39:39,10,b'In over your head? That may motivate you. https://t.co/W2ybzVxUyG'
719955247901327360,2016-04-12 18:28:01,7,"b'Donald Trump likes to vilify the media. In New York, he has a long history of embracing it. https://t.co/SisyIQQ2vR'"
719951732260913152,2016-04-12 18:14:03,19,"b'If Virgin America is ""a young, hip airline"" some see Alaska Air as ""a friendly aunt.\xe2\x80\x9d https://t.co/K3Pm5RfDnb https://t.co/ZGRuuRwu5d'"
719948703876911104,2016-04-12 18:02:01,1,b'Judge orders release of Gawker-Hulk Hogan trial documents https://t.co/Vw1w1eVklS https://t.co/ZuoRqx2GLj'
719948298291978240,2016-04-12 18:00:24,5,b'You probably are going to be interacting with a lot more chatbots soon. https://t.co/CFXg8Py79k'
719946206835777536,2016-04-12 17:52:06,4,"b""European Union proposes rules to shine a light on multinational companies' tax arrangements. https://t.co/YYCjGOVrfa https://t.co/pvee8VJqha"""
719944938847399937,2016-04-12 17:47:04,5,b'Arms control groups urge human control of robot weaponry https://t.co/lpaqm8khQl https://t.co/hm1x5VnJcM'
719944020827488260,2016-04-12 17:43:25,11,b'RT @puiwingtam: Thoughts on bots from @MikeIsaac: https://t.co/tPQqaXhVfB'
719943722495033345,2016-04-12 17:42:14,5,b'Yale advances in shaping its endowment to address climate change https://t.co/FUuvBpj0nX https://t.co/fx0uFisk9q'
719942184921874432,2016-04-12 17:36:07,48,b'Unsealed documents undercut the U.S. case for taking Fannie Mae profits https://t.co/IIT4fiDBMI https://t.co/5QuhAkz512'
719939907423191046,2016-04-12 17:27:04,12,"b'Deutsche Bank freezes North Carolina expansion, in protest of bias law https://t.co/1gJQH38cWU https://t.co/DUIsB1HPP3'"
719939729316298752,2016-04-12 17:26:21,7,b'RT @Landonthomasjr: EM stocks and bonds bouncing but IMF remains anxious about growth\nhttps://t.co/DcLv2VduRD'
719937891472928768,2016-04-12 17:19:03,5,"b'Two unions set strike deadline for 36,000 Verizon workers https://t.co/8GOFKMmYVM'"
719936635991887872,2016-04-12 17:14:04,5,b'Alan Dershowitz and 2 other lawyers settle suit and counter claim https://t.co/47g7shhMTz https://t.co/uV3xHMsmGV'
719935888013332480,2016-04-12 17:11:06,39,"b'RT @gmorgenson: What did the govt know, when did it know it re Fannie/Freddie comeback when it began profit sweep in 2012? https://t.co/cdA\xe2\x80\xa6'"
719934615616647168,2016-04-12 17:06:02,4,b'Puerto Rico aims to appease Congress with new debt proposal https://t.co/6rgAjh2LFp https://t.co/neUgO5wWWY'
719922548742438913,2016-04-12 16:18:05,1,"b'The robo-adviser Betterment is adding an ex-Charles Schwab executive, John S. Clendening, to its board https://t.co/kZImxj7f5T'"
719908960002813952,2016-04-12 15:24:05,17,b'Unsealed documents undercut the U.S. case for taking Fannie Mae profits https://t.co/omaWHIok2g https://t.co/Fde1vvAkz9'
719906989036466176,2016-04-12 15:16:16,68,"b'RT @nytimes: Hard times have returned to Wyoming, where the recession is slinking back https://t.co/yjpFG4d7qG https://t.co/w3RpscUk3Q'"
719906313694785538,2016-04-12 15:13:35,71,"b""RT @nytimes: The EU called for big companies to reveal the tax they pay to each of the bloc's 28 member countries https://t.co/l5iXSIRnMr"""
719903923193176064,2016-04-12 15:04:05,9,b'Judge orders release of Gawker-Hulk Hogan trial documents https://t.co/DVHGjxLke5 https://t.co/pi7JgVdDkU'
719899888444686337,2016-04-12 14:48:03,8,b'Arms control groups urge human control of robot weaponry https://t.co/rlYsDnFpM8 https://t.co/iXeTvLVyTS'
719897621255569408,2016-04-12 14:39:02,2,"b'For Indian start-ups, tenacity beats high tech https://t.co/fBw55IsDKD https://t.co/eIHvKYOgBW'"
719889322388897792,2016-04-12 14:06:04,10,b'Puerto Rico aims to appease Congress with new debt proposal https://t.co/2x1S3T5Kij https://t.co/jaqNdxs1eM'
719887069368160257,2016-04-12 13:57:06,3,"b'For a generalist, \xe2\x80\x9ctoo big to fail\xe2\x80\x9d may be too tricky to judge https://t.co/0oBSeBYN99 https://t.co/UMgGdp6P0C'"
719886561345736704,2016-04-12 13:55:05,12,"b'Deutsche Bank freezes North Carolina expansion, in protest of bias law https://t.co/LEfgvwDpMo https://t.co/uEEyQv9xEm'"
719884035934261249,2016-04-12 13:45:03,7,"b'At the coming oil summit, a deal to freeze production might mean more than a freeze itself. https://t.co/0qMZDNP9TO https://t.co/wFtW5c681Y'"
719882563834286081,2016-04-12 13:39:12,7,b'Unsealed documents in Fannie Mae suit shed light on bailout https://t.co/Ej182ISupl https://t.co/R3mj6chY7K'
719879999495487493,2016-04-12 13:29:01,6,b'In over your head? That may motivate you. https://t.co/7f0jl00ovC'
719876006765588480,2016-04-12 13:13:09,5,"b'E.U. pushes for more transparency on tax dealings by the biggest multinationals, @jameskanter writes.\n\nhttps://t.co/NEOeDDJ4yF'"
719873214164418560,2016-04-12 13:02:03,6,b'Judge orders release of Gawker-Hulk Hogan trial documents https://t.co/dhErzwqtcb https://t.co/v9taOSDwMK'
719869457640865792,2016-04-12 12:47:07,14,"b""European Union proposes rules to shine a light on multinational companies' tax arrangements. https://t.co/0pwt0Ns3LZ https://t.co/lv08LD29Ff"""
719869449940123648,2016-04-12 12:47:06,6,b'Arms control groups urge human control of robot weaponry https://t.co/stzZXhqdk8 https://t.co/0szCtA1DHx'
719865661435035648,2016-04-12 12:32:02,4,"b'Tesla recalls 2,700 model X S.U.V.s for a seat-back iossue https://t.co/8QE40OH2Ha'"
719863898715877378,2016-04-12 12:25:02,8,"b'Two unions set strike deadline for 36,000 Verizon workers https://t.co/h068xzc431'"
719862184059215872,2016-04-12 12:18:13,4,"b'The robo-adviser Betterment is adding an ex-Charles Schwab executive, John S. Clendening, to its board https://t.co/czPJRGhXIs'"
719861129963507712,2016-04-12 12:14:02,4,b'British regulators bar former R.B.S. trader from financial industry over Libor misconduct. https://t.co/P3tSd9KFwJ'
719859135722975233,2016-04-12 12:06:06,2,b'Puerto Rico aims to appease Congress with new debt proposal https://t.co/0E79AkbmmM https://t.co/7pxhoA32w6'
719857375843389442,2016-04-12 11:59:07,6,"b'For a generalist, \xe2\x80\x9ctoo big to fail\xe2\x80\x9d may be too tricky to judge https://t.co/JI0FeTVedd https://t.co/u8Qi47fEeT'"
719854598186471425,2016-04-12 11:48:05,164,"b'RT @KeithBradsher: Rich 18-year-old from China: hard to fit backpack, textbooks and laundry in a Lamborghini https://t.co/8yQsmyYQiY https:\xe2\x80\xa6'"
719852324513050625,2016-04-12 11:39:03,3,"b'For Indian start-ups, tenacity beats high tech https://t.co/8mlTRB3vF8 https://t.co/3vyPNVK9zl'"
719850073694281728,2016-04-12 11:30:06,11,"b'If Virgin America is ""a young, hip airline"" some see Alaska Air as ""a friendly aunt.\xe2\x80\x9d https://t.co/wZ4k6gxyr8 https://t.co/zZmA0ltVxX'"
719849303502622720,2016-04-12 11:27:02,13,"b""RT @UpshotNYT: We've coded the article on mortality and income so it automatically adjusts for your city. https://t.co/rYJF892ueU https://t\xe2\x80\xa6"""
719844539037585409,2016-04-12 11:08:06,7,"b'Donald Trump likes to vilify the media. In New York, he has a long history of embracing it. https://t.co/UaTNyrFT1k'"
719837975501258752,2016-04-12 10:42:01,98,"b'RT @nytimes: One woman has joined the Tiny House Movement, building a 160-square-foot one of her own https://t.co/mNgYtbHCwd https://t.co/3\xe2\x80\xa6'"
719834972555710464,2016-04-12 10:30:06,6,b'On the madness of autonomous war machines. https://t.co/7MmT193iR6 https://t.co/lQ7bXkGq9n'
719830937761103872,2016-04-12 10:14:04,11,b'RT @markscott82: .@spotify founders warn they could move jobs away from #Sweden https://t.co/Qh6olHqcod. And here\xe2\x80\x99s why: https://t.co/WUGtV\xe2\x80\xa6'
719827447122890752,2016-04-12 10:00:11,3,"b""On the tabloids' infatuation with Donald Trump. https://t.co/QCM2Uoqa39 https://t.co/2MFDJ1UILt"""
719823882857943040,2016-04-12 09:46:02,10,b'RT @prashantrao: The US says @GoldmanSachs will pay $5.1bn to settle claims of wrongdoing. But read the fine print: https://t.co/DVizu26N37'
719819889377193985,2016-04-12 09:30:09,16,"b'For Indian start-ups, tenacity beats high tech https://t.co/UsSPMTM9db https://t.co/YtWfePR7Lz'"
719812341982969856,2016-04-12 09:00:10,1,"b'A fallen Spanish banker from the 1990s is arrested again, in inquiry into hidden funds. https://t.co/4k0pbK7DYp https://t.co/lXy5L9WJlB'"
719778846816518148,2016-04-12 06:47:04,9,b'What would he do if a big competitor threatened his drivers-on-demand start-up? https://t.co/FDOsIF6qoq https://t.co/m1JizWupBk'
719774561307357185,2016-04-12 06:30:02,13,"b'At the coming oil summit, a deal to freeze production might mean more than a freeze itself. https://t.co/GkKWVoCz8k https://t.co/2TBlO6GDWe'"
719709893276655616,2016-04-12 02:13:04,7,"b""Trump honed his image in NYC's tabloids. Now he faces an uneasy reunion with his local press https://t.co/xRGNLzKWIR https://t.co/hm10XNa5GN"""
719706635040632832,2016-04-12 02:00:07,7,b'On the madness of autonomous war machines. https://t.co/BPwCSR7pAj https://t.co/2zOxySDK6J'
719701601242451969,2016-04-12 01:40:07,12,"b""On the tabloids' infatuation with Donald Trump. https://t.co/93ch1yUxfD https://t.co/IO9QSb92xl"""
719696753574981632,2016-04-12 01:20:52,4,b'What would he do if a big competitor threatened his drivers-on-demand start-up? https://t.co/F32RNN1Y2x https://t.co/40CwK7mhRP'
719689765050785792,2016-04-12 00:53:05,14,"b'RT @AdrianChen: So many good parts in this story about the team that blurs private parts for ""Naked and Afraid."" https://t.co/lJZK6jqO1f'"
719683984238768129,2016-04-12 00:30:07,2,"b""RT @owlese: This was Hal's best/worst Tinder date ever. https://t.co/VJGJzOpg4G https://t.co/KrVuDafVZ2"""
719680446230093826,2016-04-12 00:16:04,17,b'In over your head? That may motivate you to work harder. https://t.co/aFo2ILr7ja'
719671394292731904,2016-04-11 23:40:05,14,"b'If Virgin America is ""a young, hip airline"" some see Alaska Air as ""a friendly aunt.\xe2\x80\x9d https://t.co/eESwXZLhT8 https://t.co/hTDOaxIv4o'"
719661371663728640,2016-04-11 23:00:16,5,b'How to mark up web pages in Windows 10 https://t.co/J7Dh2NyAcD https://t.co/kZSD6kBfPu'
719657556986056704,2016-04-11 22:45:06,10,"b'With Panama Papers, the lawyers have been right in the middle of it, writes @peterjhenning  https://t.co/COq3Npg1hH https://t.co/72p2NIWvLk'"
719647225287176192,2016-04-11 22:04:03,16,b'The end of this merger is the latest black eye for the hedge fund activist Bill Ackman https://t.co/UHtTVzZ3Kx https://t.co/yWFuzRkTfn'
719644997121871872,2016-04-11 21:55:12,15,b'RT @PatcohenNYT: Interesting comparison of Panama Papers and Wikileaks and what it means for journalism https://t.co/9DfXaokCdq'
719633654624952320,2016-04-11 21:10:08,7,"b'Donald Trump likes to vilify the media. In New York, he has a long history of embracing it. https://t.co/SGX472oApg https://t.co/8VimW42E6l'"
719627352414765058,2016-04-11 20:45:05,7,b'RT @peterjhenning: Goldman throws $5.1b in the subprime mortgage settlement pot for peddling bad RMBS before the financial crisis. https://\xe2\x80\xa6'
719623311353913344,2016-04-11 20:29:02,6,"b'If Virgin America is ""a young, hip airline"" some see Alaska Air as ""a friendly aunt.\xe2\x80\x9d https://t.co/OkQptGfCA8 https://t.co/d1J5xg0VMU'"
719618552928595970,2016-04-11 20:10:07,11,"b""RT @peterjhenning: Where were the lawyers? With the Panama Papers, it's clear they are right in the middle of client conduct. https://t.co/\xe2\x80\xa6"""
719617534224384000,2016-04-11 20:06:04,26,b'Goldman Sachs is the last of the big American banks to reach a settlement over the mortgage crisis https://t.co/vSbNRbLpi5'
719609737113944064,2016-04-11 19:35:05,6,"b'At the coming oil summit, a deal to freeze production might mean more than a freeze itself. https://t.co/CFJN0h5wAR https://t.co/yISNMb32gW'"
719604713365381124,2016-04-11 19:15:07,3,b'RT @GregoryNYC: Tinker meets tailor for smart garments: U.S. Textile Industry Turns to Tech as Gateway to Revival https://t.co/Au2cA7C3NJ @\xe2\x80\xa6'
719600952211279873,2016-04-11 19:00:11,5,"b""Here's the latest black eye for the hedge fund activist Bill Ackman https://t.co/rQtGnFwSTx https://t.co/2weZVA0t4w"""
719593976202928128,2016-04-11 18:32:27,6,"b'New York, in many ways, is a model city for factors that predict where the poor live longer https://t.co/J6LRbZltPG https://t.co/zOzNDj98MK'"
719580796709969921,2016-04-11 17:40:05,5,b'This year\xe2\x80\x99s music festival season is starting up: https://t.co/CuWGCpkQbD https://t.co/QN0tYWIfvP'
719578289573085184,2016-04-11 17:30:08,7,"b'Black third-graders are half as likely as whites to be in gifted programs, a study found https://t.co/cgIhs6iAFU'"
719570772302393349,2016-04-11 17:00:15,9,"b'If Virgin America is ""a young, hip airline"" some see Alaska Air as ""a friendly aunt.\xe2\x80\x9d https://t.co/qKDKJGrlnf https://t.co/r9I8WCQYfF'"
719567270738075648,2016-04-11 16:46:20,14,b'Goldman Sachs settles inquiry related to housing bubble https://t.co/c1osQoKTn3'
719561164838068224,2016-04-11 16:22:05,11,b'In over your head? That may motivate you. https://t.co/B6pjPoqzZh'
719558886508859392,2016-04-11 16:13:01,3,b'Did you hear the joke about SodaStream? Comedians take on ads: https://t.co/LjJEDoTdpj'
719553113288536069,2016-04-11 15:50:05,7,b'Poor New Yorkers fare better than poor elsewhere in America https://t.co/Ngpfxb5YdO https://t.co/2wxwc03pb7'
719547569207132164,2016-04-11 15:28:03,9,"b""Trump honed his image in NYC's tabloids. Now he faces an uneasy reunion with his local press https://t.co/hMTdx6AB2E https://t.co/ys28rQt2q2"""
719533735834710016,2016-04-11 14:33:05,4,b'Intuit -- not just for software anymore https://t.co/mQQKdmCaA4'
719525448372326400,2016-04-11 14:00:09,5,b'Daily Mail confirms that it is considering a potential bid for Yahoo https://t.co/a60bdJq24S'
719521935139467265,2016-04-11 13:46:12,6,"b'Donald Trump likes to vilify the media. In New York, he has a long history of embracing it. https://t.co/Lrk2ocXoi3 https://t.co/Vp9kJBHzZM'"
719515369266917376,2016-04-11 13:20:06,7,b'A Chinese groups buys a Swiss provider of catering and logistics services to airlines https://t.co/IHXkJ2RM0w'
719512340488695809,2016-04-11 13:08:04,2,b'CaixaBank reaches an 11th-hour agreement with an Angolan investor who had blocked its bid. https://t.co/8voiejwgq4 https://t.co/1yNkvEyE5R'
719506866162806784,2016-04-11 12:46:19,7,b'A look at the week ahead: Trans-Atlantic data deal and oil prices  https://t.co/2CN4aQm1Da https://t.co/WW4UCdOJw8'
719504688853487616,2016-04-11 12:37:40,11,"b'RT @prashantrao: In San Francisco, one advertising agency is enlisting comedians to get the creative juices flowing: https://t.co/2PiEHYSsP8'"
719499244441374720,2016-04-11 12:16:02,12,b'Poor New Yorkers tend to live far longer than other low-income Americans https://t.co/NVo8yGfu9E https://t.co/xGBZS7tbbp'
719494218461356033,2016-04-11 11:56:03,4,b'GE Money Bank is planning to list its shares on the Prague Stock Exchange https://t.co/CUtKMT7mzd https://t.co/oghuzpgtQc'
719489178304712704,2016-04-11 11:36:02,10,b'Boston Globe Envisions Trump Presidency With Mock Front Page https://t.co/LjEI95mwiO https://t.co/VVgrtvExsf'
719484153226534913,2016-04-11 11:16:04,4,b'The S.E.C.\xe2\x80\x99s foot-dragging prevents IEX from becoming an exchange. Now it may let the Big Board copy its technology. https://t.co/1LIQonBwpM'
719479127280087041,2016-04-11 10:56:05,1,"b'\xe2\x80\x9cThis is a totally weird work environment,\xe2\x80\x9d said the leader of the so-called Blur Man Group https://t.co/0N6c5biXmQ https://t.co/FDc0TnGJuv'"
