b'id',b'created_at',b'retweet_count',b'text'
712712198498492418,2016-03-23 18:46:44,5,"b'As winds rip across the center of the country, companies work to get the power to the coasts https://t.co/3kN8TDWGbW https://t.co/uzN0VwZ9fV'"
712709524529000448,2016-03-23 18:36:06,2,b'Labor Dept to require more disclosure when employers hire outsiders to influence union votes https://t.co/hK4KNjQtn1'
712709005798465537,2016-03-23 18:34:03,5,"b'As winds rip across the center of the country, companies work to get the power to the coasts https://t.co/6VdBNn9Kct https://t.co/Gt58G6cSdg'"
712707334699663361,2016-03-23 18:27:24,10,b'Puerto Rico Fights for Chapter 9 Bankruptcy in Supreme Court https://t.co/TuixxPQbOG'
712701954695237637,2016-03-23 18:06:02,1,"b'KKR, the private equity firm, is moving here, to a Hudson Yards tower-to-be, from Midtown. https://t.co/loIqg621Ml https://t.co/3UQLrSVleO'"
712701591128776705,2016-03-23 18:04:35,121,"b'RT @nytimes: The Uber model, it turns out, doesn\xe2\x80\x99t translate https://t.co/BCvamWVXS8'"
712700947185672192,2016-03-23 18:02:01,3,"b'But the law firm Skadden, Arps plans to leave this Midtown tower. Cond\xc3\xa9 Nast already did. https://t.co/loIqg621Ml https://t.co/8x6DmymvIm'"
712699222047514624,2016-03-23 17:55:10,2,"b""Midtown Manhattan's towers used to be the place for law firms, banks and publishing houses https://t.co/loIqg621Ml https://t.co/xM7OaDUbKB"""
712695924246577153,2016-03-23 17:42:04,2,b'Square-Facebook initiative aims to help small businesses buy and target advertising https://t.co/Lu37P72V97'
712693414123405312,2016-03-23 17:32:05,2,b'Square-Facebook initiative aims to help small businesses buy and target advertising https://t.co/Uf3yQI5ZEQ'
712692934500556804,2016-03-23 17:30:11,9,"b'Do start-ups have time for succession planning? \xe2\x80\x9cEarly on, you\xe2\x80\x99re more worried about making payroll next week.\xe2\x80\x9d https://t.co/2IGj2snq0S'"
712692917169692672,2016-03-23 17:30:07,5,b'There are plenty of apps that you can use to encrypt your smartphone communications  https://t.co/9Zq0u1OBPL'
712689330364530689,2016-03-23 17:15:52,5,"b'The on-demand dream \xe2\x80\x93 cheap, convenient service, a model created by hypersuccessful Uber \xe2\x80\x93 is mainly unattainable https://t.co/5XpidCcbVB'"
712687361520443392,2016-03-23 17:08:02,9,"b'The Uber model, it turns out, doesn\xe2\x80\x99t translate https://t.co/fxgFY1mRdC https://t.co/SlMInNJh7U'"
712681405210365952,2016-03-23 16:44:22,6,"b""RT @portereduardo: For the poor, marriage is pretty much over. The government can't restore it. Trying to do so is pointless. https://t.co/\xe2\x80\xa6"""
712677814491824132,2016-03-23 16:30:06,6,b'Labor Dept to require employers to disclose the use of anti-union consultants https://t.co/CVJWjd5XBr https://t.co/g1jo6wdLzC'
712675725791399936,2016-03-23 16:21:48,7,"b'Do start-ups have time for succession planning? \xe2\x80\x9cEarly on, you\xe2\x80\x99re more worried about making payroll next week.\xe2\x80\x9d https://t.co/cXh4O7e46t'"
712670280754327553,2016-03-23 16:00:10,2,b'Taking someone off your iPhone\xe2\x80\x99s blocked list https://t.co/297TnFEheK'
712668504198103040,2016-03-23 15:53:06,1,"b'Leon H. Charney, investor, cable TV host and peace broker, is dead at 77 https://t.co/iL0RTrgDSl'"
712666729198043136,2016-03-23 15:46:03,7,"b'Tom Hayes, an ex-trader convicted in the Libor case, is ordered to pay $1.2 million https://t.co/scfPB1HDoP https://t.co/NrdOf6s7ZA'"
712663460472102914,2016-03-23 15:33:04,5,"b'SIx years after the \xe2\x80\x9cflash crash,\xe2\x80\x9d judge orders extradition of British trader to face charges in US https://t.co/AW0yyc29A2'"
712662739232153600,2016-03-23 15:30:12,11,b'Square-Facebook initiative aims to help small businesses buy and target advertising https://t.co/Lfrux4b5Am'
712659847607619585,2016-03-23 15:18:42,2,b'RT @Chadbray: Former trader Tom Hayes ordered to forfeit about $1.2M in bonuses following his conviction for manipulating Libor. https://t.\xe2\x80\xa6'
712657255729070082,2016-03-23 15:08:24,7,"b""Jeff Pino's unexpected death in a plane crash was a cataclysm for his fledgling company https://t.co/dDlz3bChPe https://t.co/UIhpV1fV6y"""
712655224008261632,2016-03-23 15:00:20,9,"b'RT @amyjccuddy: Talking w/ @AdamMGrant &amp; @nytcorneroffice abt presence, power, &amp; listening, at the @nytimesbusiness New Work Summit: https:\xe2\x80\xa6'"
712651392977092609,2016-03-23 14:45:07,9,"b""Why you still can't use the chip on your new digital credit card at many stores https://t.co/3OBFYFKxXy https://t.co/DUE8UetKMr"""
712651073681559552,2016-03-23 14:43:51,3,b'Labor Dept to require more disclosure when employers hire outsiders to influence union votes https://t.co/T0UA0Duqop'
712647363286994944,2016-03-23 14:29:06,5,"b""Jeff Pino's unexpected death in a plane crash was a cataclysm for his fledgling company https://t.co/YaCtqmveI4 https://t.co/8G0C7d2pCe"""
712643530792034306,2016-03-23 14:13:52,3,b'A fitness store is challenging Lululemon with $400 yoga pants https://t.co/xAh9RGEnJQ https://t.co/XPv912sKoQ'
712640498746408960,2016-03-23 14:01:49,1,"b'Declines in mining shares, as commodity prices weaken, are pushing Wall St. lower today  https://t.co/SAHxKYK4wn https://t.co/VpmuSVJzG0'"
712639049727651841,2016-03-23 13:56:04,5,"b""Why you still can't use the chip on your new digital credit card at many stores https://t.co/nQlRcRwfD3 https://t.co/4y4H2SIqsq"""
712633357088202752,2016-03-23 13:33:27,2,"b'SIx years after the \xe2\x80\x9cflash crash,\xe2\x80\x9d judge orders extradition of British trader to face charges in US https://t.co/jIk24f1lAh'"
712627729972260865,2016-03-23 13:11:05,2,b'Ukrainian Pilot Sentenced to 22 Years Over Russian Reporters\xe2\x80\x99 Deaths https://t.co/NV7F6hsqWq https://t.co/WrWCGc0IJ7'
712624186674556928,2016-03-23 12:57:00,2,b'Australian Energy Giant Woodside Delays Large Offshore L.N.G. Project https://t.co/KizzjVR3u7'
712623951265054720,2016-03-23 12:56:04,8,b'Supreme Court hears plea for help from Puerto Rico https://t.co/Pl2qptG9a8'
712622436399902720,2016-03-23 12:50:03,10,"b'The on-demand dream \xe2\x80\x93 cheap, convenient service, a model created by hypersuccessful Uber \xe2\x80\x93 is mainly unattainable https://t.co/4ptdxWjqvc'"
712621431939600384,2016-03-23 12:46:03,5,"b""Why you still can't use the chip on your new digital credit card at many stores https://t.co/x05UpC8IrY https://t.co/AgLefeOjfW"""
712619169976549376,2016-03-23 12:37:04,2,b'ZTE is granted a three-month reprieve on tough export restrictions imposed by U.S. https://t.co/6VbNLMRMIl'
712617417051152384,2016-03-23 12:30:06,38,"b'Do start-ups have time for succession planning? \xe2\x80\x9cEarly on, you\xe2\x80\x99re more worried about making payroll next week.\xe2\x80\x9d https://t.co/777xdxzA4E'"
712614128406433793,2016-03-23 12:17:02,6,"b""Deal Professor: What's behind Anbang's American shopping spree https://t.co/wpdizNXoUw https://t.co/eVkdn4T0Er"""
712611869056483328,2016-03-23 12:08:03,8,b'Other tech companies reward hackers with money for finding bugs. Apple gives a gold star. https://t.co/IF4CVV5eKE'
712609104951386112,2016-03-23 11:57:04,18,b'Nuclear plant leak threatens drinking water wells in Florida https://t.co/oTlxA5uEGd https://t.co/leqBcqx6aB'
712607351723966464,2016-03-23 11:50:06,6,"b'Latest from @fmanjoo: Other than the hypersuccessful Uber, many on-demand companies have come under stress https://t.co/Zv0bmD2SUU'"
712604075884482560,2016-03-23 11:37:05,17,"b'Credit Suisse plans to accelerate its cost cutting, further shrinking its trading business https://t.co/P4X2com7fF https://t.co/ytrU2SJfcM'"
712600306207559682,2016-03-23 11:22:07,9,b'Goldman Banker in Document Leak Case Avoids Prison https://t.co/YmR6QfMmPX https://t.co/bB6RmkBsGo'
712596524820209664,2016-03-23 11:07:05,5,b'Apple Policy on Bugs May Explain Why Hackers Might Help F.B.I. https://t.co/hMpH82m5rl'
712591476404961281,2016-03-23 10:47:01,8,"b""Why you still can't use the chip on your new digital credit card at many stores https://t.co/YIuO4QbYJc https://t.co/iV1btQD5oO"""
712586450513043456,2016-03-23 10:27:03,15,b'Puerto Rico Fights for Chapter 9 Bankruptcy in Supreme Court https://t.co/5k6FOU7pM0'
712574116692410368,2016-03-23 09:38:03,6,b'Pushing the poor to marry is pointless. We might have figured that out by now. https://t.co/aG3RppTvTv https://t.co/PyZ8kaexYD'
712513737312313349,2016-03-23 05:38:07,11,b'Pushing the poor to marry is pointless. We might have figured that out by now. https://t.co/3L5XHkTb4H https://t.co/HubkZzYof6'
712458111592865792,2016-03-23 01:57:05,7,b'Carmakers want more flexibility in meeting mileage and emissions standards https://t.co/oCbJGmhZ5W https://t.co/8dXXbqF3lm'
712451321467641857,2016-03-23 01:30:06,5,b'Keeping up with Android security patches https://t.co/zo8nUYLLDj'
712445777264709633,2016-03-23 01:08:04,6,b'Better to aid families as they are than try to restore the stable two-parent family of yore. https://t.co/LERn79oUjT https://t.co/fCh9RbxNne'
712429658806067200,2016-03-23 00:04:01,8,b'RT @portereduardo: Living With One Parent in the US is a particularly raw deal. https://t.co/H3WLF187A8'
712415679270535168,2016-03-22 23:08:28,5,b'RT @SteveLohr: Creating a marketplace for smartphone sensor data. https://t.co/YqGNQGmwYv @crowdsignals_io #datascience #bigdata'
712410082299002881,2016-03-22 22:46:14,5,"b'New York is pushing the SEC to investigate gun maker Sturm, Ruger\xe2\x80\x99s investor disclosures about the risks it faces. https://t.co/HgttWnRLx0'"
712404510656876544,2016-03-22 22:24:05,11,b'One reason for Bernie Sanders\xe2\x80\x99s gap among African-Americans: They have more favorable impressions of the economy https://t.co/XQOuMAKCag'
712399967562899456,2016-03-22 22:06:02,9,b'Pushing the poor to marry is pointless. We might have figured that out by now. https://t.co/P52CGV3YDR https://t.co/ysNvt6lUXy'
712397448996659201,2016-03-22 21:56:02,7,b'Carmakers want more flexibility in meeting mileage and emissions standards https://t.co/7p3kpboqx6 https://t.co/DmaMPjPkSs'
712394956720218113,2016-03-22 21:46:07,7,"b'RT @NYTmag: How can Donald Trump and Bernie Sanders both be ""populist""? https://t.co/Sd7b78oYSg'"
712390913121771520,2016-03-22 21:30:03,1,b'Should movies with on-screen smoking get an R Rating? https://t.co/0qdAHZDlqS'
712389919268868096,2016-03-22 21:26:06,6,"b'NYT obit of Andrew Grove, longtime Intel chief who helped lead the semiconductor revolution https://t.co/MtfaOOluCh https://t.co/b6YEzcxqu9'"
712386875646992384,2016-03-22 21:14:01,2,"b'More and more, investors question whether gun makers represent their reputational risks to shareholders. https://t.co/CaGWhwWy39'"
712384999513833474,2016-03-22 21:06:34,82,"b""Why you still can't use the chip on your new digital credit card at many stores https://t.co/qTG4z6325J https://t.co/Rj5eNk1lp1"""
712384876931125248,2016-03-22 21:06:04,4,b'Merchants still have many hoops in order to use digital chips on your credit cards. https://t.co/xaGZVhxIoA https://t.co/6cl6d4LAiU'
712384433458913281,2016-03-22 21:04:19,6,"b""RT @PatcohenNYT: When is a university not a university? When it's Trump's -- but there are others misnamed as well. https://t.co/cpUNfkUe2R\xe2\x80\xa6"""
712381073896939521,2016-03-22 20:50:58,10,"b'RT @portereduardo: For the poor, marriage is over. But we can still help poor families and children https://t.co/vq8Q7EC54j'"
712379770810540033,2016-03-22 20:45:47,6,"b'A Florida town curbs debauchery, and pays the price https://t.co/1IZOLz1oe4 https://t.co/MKA0MXDKqz'"
712374188733014017,2016-03-22 20:23:36,9,b'Asking rents at the top buildings in Midtown have dropped https://t.co/Jym00hFCMS https://t.co/OgEDGinqMu'
712372346116509700,2016-03-22 20:16:17,6,b'Pushing the poor to marry is pointless. We might have figured that out by now. https://t.co/NMxHhedd0y https://t.co/PxCcPYlWgd'
712368283085881344,2016-03-22 20:00:08,1,b'Keeping up with Android security patches https://t.co/9ON4toK410'
712367005660258304,2016-03-22 19:55:03,3,b'Carmakers want more flexibility in meeting mileage and emissions standards https://t.co/vkgpR8IEuC https://t.co/CYDmtTKgXH'
712364195925377024,2016-03-22 19:43:54,8,b'Better to aid families as they are than try to restore the stable two-parent family of yore. https://t.co/nHqR0hxC6Q https://t.co/bLm4ChV4s7'
712362409135116289,2016-03-22 19:36:48,5,b'Pushing the poor to marry is pointless. We might have figured that out by now. https://t.co/bFqUSBRMBu https://t.co/V3I4rTWEcz'
712359603607052290,2016-03-22 19:25:39,3,b'RT @LizMoyer: Shareholder activists increasingly pushing gun makers and retailers about their investor disclosures https://t.co/Y4UdZLdnDm'
712353899253010432,2016-03-22 19:02:59,1,"b""Midtown Manhattan's towers used to be the place for law firms, banks and publishing houses https://t.co/bGioE5FHz1 https://t.co/ED1lJdPedT"""
712350329631854592,2016-03-22 18:48:48,3,"b'The big law firm Skadden, Arps plans to leave this Midtown tower. Cond\xc3\xa9 Nast already did. https://t.co/SQICMmxqxs https://t.co/eNAsFi8B3G'"
712348480962994176,2016-03-22 18:41:27,3,b'Lumber Liquidators settles with California clean air agency https://t.co/tpRX8nurSE'
712347376678281216,2016-03-22 18:37:04,3,"b'A company that is trying to sell itself, struggling with a turnaround, and fending off an activist shareholder https://t.co/xrLiRRV37N'"
712344615907692545,2016-03-22 18:26:05,3,b'One reason for Bernie Sanders\xe2\x80\x99s gap among African-Americans: They have more favorable impressions of the economy https://t.co/Eni3UoLIfc'
712342124386250752,2016-03-22 18:16:11,4,b'Carmakers want more flexibility in meeting mileage and emissions standards https://t.co/GLmxjA1W1P https://t.co/wx915c7Aix'
712337058992365568,2016-03-22 17:56:04,7,b'Hulk Hogan is awarded another $25 million in Gawker case https://t.co/6xZbldhHdp https://t.co/GR06S2BIx3'
712336656129531905,2016-03-22 17:54:28,4,b'Carmakers want more flexibility in meeting mileage and emissions standards https://t.co/yCuhv29trc https://t.co/GG30RMBip1'
712326050236203008,2016-03-22 17:12:19,7,b'Asking rents at the top buildings in Midtown have slipped https://t.co/nsknx1iSf2 https://t.co/jbLgi5YcDv'
712325797701423104,2016-03-22 17:11:19,3,"b""Midtown Manhattan's towers used to be the place for law firms, banks and publishing houses https://t.co/9RKrCYDF5O https://t.co/ilwQoUMHRJ"""
712325654390378497,2016-03-22 17:10:45,11,"b'The big law firm Skadden, Arps plans to leave this Midtown tower. Cond\xc3\xa9 Nast already did. https://t.co/mQZZ3gCX1P https://t.co/FSKK55ukWR'"
712322413669834754,2016-03-22 16:57:52,5,b'Fuel efficiency gains have stalled since gas prices plunged. https://t.co/jvRC5cWbCm https://t.co/xwCehWzpj1'
712315460184842240,2016-03-22 16:30:14,4,"b'Bill Ackman, who missed any signs of chicanery at Valeant, tries to salvage his investment. https://t.co/yUbtGOCFGG https://t.co/LqgGbUDBCG'"
712309629343010816,2016-03-22 16:07:04,7,"b'U.S. wins delay in court hearing, says it may not need Apple\xe2\x80\x99s help to unlock iPhone https://t.co/9UURmkBHsM https://t.co/e7UHLEuG7o'"
712307924387766273,2016-03-22 16:00:17,0,b'Keeping up with Android security patches https://t.co/UpuBHANOsh'
712305349798334464,2016-03-22 15:50:04,2,b'Hulk Hogan is awarded another $25 million in Gawker case https://t.co/MOSZUQM3Zv https://t.co/n7NEMaWEoR'
712301590129086464,2016-03-22 15:35:07,4,"b'A company that is trying to sell itself, struggling with a turnaround, and fending off an activist shareholder https://t.co/zmOvXRIPwY'"
712299319290896385,2016-03-22 15:26:06,5,b'One reason for Bernie Sanders\xe2\x80\x99s gap among African-Americans: They have more favorable impressions of the economy https://t.co/y821oMa0R6'
712295285750435840,2016-03-22 15:10:04,3,b'Age discrimination cases are difficult to prove because there is rarely a \xe2\x80\x9csmoking gun\xe2\x80\x9d https://t.co/8NFSz7pRnl'
712292807382343681,2016-03-22 15:00:13,6,b'Tech Tip: Putting Your Twitter Feed Back in Chronological Order https://t.co/MVV39w9P9K'
712289702246744065,2016-03-22 14:47:53,5,b'Briefing: Airbus tests its first plane made in U.S. and deems it a success https://t.co/vTkefiw4Lx'
712283971569188865,2016-03-22 14:25:07,8,"b'NYT obit of Andrew Grove, longtime Intel chief who helped lead the semiconductor revolution https://t.co/IN6svrbJcO https://t.co/k0caSWaLhu'"
712279169711738880,2016-03-22 14:06:02,7,"b'U.S. wins delay in court hearing, says it may not need Apple\xe2\x80\x99s help to unlock iPhone https://t.co/sSDM658MlF https://t.co/hQ7P5FcMKf'"
712276801830166529,2016-03-22 13:56:37,6,"b'Bill Ackman, who missed any signs of chicanery at Valeant, tries to salvage his investment. https://t.co/iKF8QyoI3y https://t.co/HdfjQwsCxt'"
712275148116791296,2016-03-22 13:50:03,6,b'Hulk Hogan is awarded another $25 million in Gawker case https://t.co/TfV4tSk7Fa https://t.co/wAcJfQAPqQ'
712271385150808065,2016-03-22 13:35:06,2,"b'A company that is trying to sell itself, struggling with a turnaround, and fending off an activist shareholder https://t.co/orrkSeooal'"
712268853586370560,2016-03-22 13:25:02,4,b'One reason for Bernie Sanders\xe2\x80\x99s gap among African-Americans: They have more favorable impressions of the economy https://t.co/Q8wmeg9iEH'
712263567551143936,2016-03-22 13:04:02,14,b'BP and Statoil are pulling employees after a new attack on Algerian gas facilities https://t.co/0MzuKvYjcO https://t.co/WtjP9Vat2h'
712249238349082624,2016-03-22 12:07:06,4,b'Judge approves Orange County Register sale to Digital First https://t.co/dbdLApunFC'
712247511252127746,2016-03-22 12:00:14,15,"b'NYT obit of Andrew Grove, longtime Intel chief who helped lead the semiconductor revolution https://t.co/bzDJ7AEf8p https://t.co/Um1ErLr0IG'"
712243704006885376,2016-03-22 11:45:06,3,b'Anthem sues Express Scripts over cost of prescriptions https://t.co/5hOuVTuKm0'
712239943888855042,2016-03-22 11:30:10,4,"b""The U.S. says now it may not need Apple\xe2\x80\x99s help to unlock the San Bernardino shooter's iPhone https://t.co/PG7GQI7JtA https://t.co/WDVrIr7vZE"""
712237403637989376,2016-03-22 11:20:04,6,b'Analysts urge Citigroup split https://t.co/DlZwf5lhnp'
712232392153559040,2016-03-22 11:00:09,3,b'Breakingviews: Valeant\xe2\x80\x99s struggles could lead it to crumble https://t.co/FYRJbxTJDv'
712228608631304192,2016-03-22 10:45:07,10,b'Apple\xe2\x80\x99s modest product upgrades take back seat to worries on iPhone encryption https://t.co/2tWV48qhzm https://t.co/DtxTIzPFsE'
712224835691270148,2016-03-22 10:30:07,13,"b'Andrew S. Grove, longtime chief of Intel, dies at 79 https://t.co/E7rXXV1jlo'"
712221041616134144,2016-03-22 10:15:03,6,b'CrowdSignals aims to create a marketplace for smartphone sensor data https://t.co/NtXfJchVJG https://t.co/gAlL1Nr3h0'
712217294684954625,2016-03-22 10:00:10,3,b'Hulk Hogan awarded another $25 million in Gawker case https://t.co/plVWoHKSUt'
712213507366887424,2016-03-22 09:45:07,4,b'Why Sanders trails Clinton among minority voters https://t.co/qZJWjqHkTx https://t.co/LY17QJf6U2'
712209739644608512,2016-03-22 09:30:08,3,b'White Collar Watch: Apple may be willing to risk contempt charge https://t.co/Kwo9bZnvWV'
712205941429694464,2016-03-22 09:15:03,1,b'Stay or go? Cuban entrepreneurs divided on where to stake futures https://t.co/EVkTz9rjTG'
712202201410756608,2016-03-22 09:00:11,5,"b'At microhotels, the price is right and the space is tight https://t.co/22bEBE1F2z https://t.co/HyCz2AGSaf'"
712175247664029700,2016-03-22 07:13:05,12,"b""On Apple's stand against the Justice Department. https://t.co/QTh19PCnSb https://t.co/S2we9oF7iP"""
712165543474810880,2016-03-22 06:34:31,8,b'James Patterson has a big plan for small books https://t.co/25avpzlkiI https://t.co/OEZB2VIy60'
712160141844549632,2016-03-22 06:13:03,4,"b'The iPhone SE packs a faster chip, a better camera &amp; Apple Pay technology into the 4-inch case of the old iPhone 5S. https://t.co/2wrvk0fEKu'"
712158879514304512,2016-03-22 06:08:02,21,"b""If you can't handle criticism, it could hinder your ability to do work that matters https://t.co/CuSxI8FhaR https://t.co/mlCxJusLbO"""
712155632267366400,2016-03-22 05:55:08,2,b'Valeant to replace Michael Pearson as chief executive and puts William Ackman on board https://t.co/aL3VHXtc1j https://t.co/4PgLEl96m4'
712150350699085825,2016-03-22 05:34:09,7,"b""James Patterson's plan to revive reading: Plot-driven novels short enough to read in one sitting, under $5  https://t.co/1tC94MN8rt"""
712144795112759296,2016-03-22 05:12:04,8,b'Government tells judge in Apple case: Never mind. https://t.co/1zZImFDXzR https://t.co/7uLG8Icd6Q'
712141771841601538,2016-03-22 05:00:04,6,b'BP and Statoil Pull Employees From Algeria Gas Fields After Attack https://t.co/fVtYg8XcrL https://t.co/di9Jj3GjcW'
712134844399144960,2016-03-22 04:32:32,11,b'Amazon has emerged as one of the tech industry\xe2\x80\x99s most outspoken players in Washington https://t.co/G2KJ7ddpxF https://t.co/9YCm3vDnZu'
712129441946796034,2016-03-22 04:11:04,12,b'Why does Hillary do so much better among black voters than Bernie? Because they see the economy differently. https://t.co/7nGqUteCmN'
712128692957421568,2016-03-22 04:08:05,4,b'Leon Cooperman says his hedge fund Omega Advisors could face possible enforcement actions https://t.co/AR6nSOlhcc'
712114351021367296,2016-03-22 03:11:06,10,b'A jury awarded Hulk Hogan $25 million in punitive damages on top of $115 million assessed. https://t.co/HezLfQzKli https://t.co/DWt1qDWcv7'
712107544009957377,2016-03-22 02:44:03,6,b'The Supreme Court has not heard a design patent case in more than a century. Until now https://t.co/nVVMMULK1r'
712106278777184256,2016-03-22 02:39:01,10,"b""The Web's era of sensationalism has passed. It's a more self-correcting place these days https://t.co/WO3yzzmIFu https://t.co/ySYf9WEO1E"""
712099997169405952,2016-03-22 02:14:04,15,"b'50 million boxes of mac-and-cheese later, Kraft owns up https://t.co/rpnd8lDLhg https://t.co/VeSDoUnrCg'"
712086160361787394,2016-03-22 01:19:05,7,b'Price is right and space is tight: Microhotels are big https://t.co/XseMPO6QNL https://t.co/SBG83FbDVP'
712083374635139072,2016-03-22 01:08:01,13,"b""If you can't handle criticism, it could hinder your ability to do work that matters https://t.co/gy73AJ6AMs https://t.co/e3EwTEUhsL"""
712076350815920128,2016-03-22 00:40:06,16,b'A jury awarded Hulk Hogan $25 million in punitive damages on top of $115 million assessed. https://t.co/TzUiZDpbyT https://t.co/efvwZpje6N'
712072068217638912,2016-03-22 00:23:05,9,b'Apple\xe2\x80\x99s modest product upgrades take back seat to worries on iPhone encryption https://t.co/rjHDBPLj8C https://t.co/tYlOshEJcK'
712071314379505666,2016-03-22 00:20:05,5,b'Why does Hillary do so much better among black voters than Bernie? Because they see the economy differently. https://t.co/xcoiHDjLF9'
712067534707679233,2016-03-22 00:05:04,3,b'Rihanna Is Back at Top Spot on Billboard https://t.co/vdGtuH4u1A'
712063753991426048,2016-03-21 23:50:03,5,"b'On top of the $115 million in compensatory damages, a jury assessed Gawker $25 million more in punitive damages. https://t.co/Cmfx8VYnrd'"
712062510518673411,2016-03-21 23:45:06,7,b'The Supreme Court has not heard a design patent case in more than a century. Until now https://t.co/gkvpI1UApD'
712059997383999489,2016-03-21 23:35:07,7,"b""One reason for Bernie Sanders' poor performance among blacks is that they have faced better economic trends lately. https://t.co/R2twJGktXe"""
712057484043751424,2016-03-21 23:25:08,63,b'Government tells judge in Apple case: Never mind. https://t.co/sLqyYVxq2J https://t.co/Kj1wLsLS6L'
712056702074560512,2016-03-21 23:22:01,3,"b""Breaking down Apple's fight with the U.S. government https://t.co/zd1TD4o2Mt"""
712054944027832321,2016-03-21 23:15:02,5,"b""The U.S. says now it may not need Apple\xe2\x80\x99s help to unlock the San Bernardino shooter's iPhone https://t.co/IhiUX0rxfL https://t.co/KtMvp3zuyF"""
712053898798874625,2016-03-21 23:10:53,7,"b""The Justice Department said it may not need Apple\xe2\x80\x99s assistance to crack the terrorist's iPhone. https://t.co/NXV07ZL5Kq"""
712051677319270401,2016-03-21 23:02:03,1,b'Leon Cooperman says the trading in question involved a single security in July 2010: https://t.co/j1iuYjWKMD'
712051178952122369,2016-03-21 23:00:04,0,"b""\xe2\x80\x9cA plane crashed into my house. Not good.\xe2\x80\x9d ~The unflappable judge who's on the Apple case. https://t.co/DzRaHEHYl4 https://t.co/EKczkhumLc"""
712049664359587840,2016-03-21 22:54:03,1,"b'Judge in Apple case is seen as unfazed by stress, even a plane crash https://t.co/fZ7r35nLcl https://t.co/bLqKhMOeKd'"
712047409090707456,2016-03-21 22:45:06,5,"b'The iPhone SE packs a faster chip, a better camera &amp; Apple Pay technology into the 4-inch case of the old iPhone 5S. https://t.co/lJ8VdFO0qS'"
712045904514183169,2016-03-21 22:39:07,4,"b""The Web's era of sensationalism has passed. It's a more self-correcting place these days https://t.co/G6WCsVkoMf https://t.co/IQNh3KnEFL"""
712045131617140737,2016-03-21 22:36:03,5,b'BP and Statoil Pull Employees From Algeria Gas Fields After Attack https://t.co/5jmyKEC1d4'
712043640361787393,2016-03-21 22:30:07,7,"b""On Apple's stand against the Justice Department. https://t.co/vbv8t3idU4 https://t.co/ZWKF1A79wO"""
712040097152155648,2016-03-21 22:16:02,5,"b'50 million boxes of mac-and-cheese later, Kraft owns up https://t.co/5CyJ1aV503 https://t.co/35JRoI4Mfs'"
712039877601333248,2016-03-21 22:15:10,0,b'Judge Approves Orange County Register Sale to Digital First https://t.co/daHTS5tMV1'
712039102225489920,2016-03-21 22:12:05,4,b'Leon Cooperman and Omega Advisors Receive S.E.C. Notice https://t.co/DLP3XA5L0e'
