b'id',b'created_at',b'retweet_count',b'text'
716962601700352000,2016-04-04 12:16:19,5,b'One of Wall Street\xe2\x80\x99s top deal makers is defecting after 25 years at a white-shoe law firm https://t.co/yLKZyTTwo9'
716958534278184960,2016-04-04 12:00:09,4,"b'Blossom, Bubbles and Buttercup face a new challenge: a fight for relevancy https://t.co/2p7dwMN9z5 https://t.co/TOqlks9gxS'"
716958530234937345,2016-04-04 12:00:08,7,b'Drawing the Line on Gossip After the Gawker Trial https://t.co/UD4e4YI8Cw https://t.co/Ds8XsTVrvy'
716953476283113472,2016-04-04 11:40:03,2,"b""China's carbon dioxide emissions may be falling modestly, as its economy grows more slowly https://t.co/kRcMRwpXHZ"""
716950464252747776,2016-04-04 11:28:05,9,"b""Alaska Airlines' parent company has agreed to buy Virgin America for $2.6 billion https://t.co/NaSG6fD4SE https://t.co/a9Z3glHsE2"""
716948454904303617,2016-04-04 11:20:06,5,"b""Britain's newest newspaper has a little something for everyone \xe2\x80\x94 except a website https://t.co/Mm1c8bKFMY https://t.co/bMDd8J1pqN"""
716944056543277056,2016-04-04 11:02:37,7,b'RT @Chadbray: Parent of Alaska Airlines has agreed to acquire Virgin America for $2.6 billion in cash. https://t.co/8ChkT8mnCi'
716943414810517504,2016-04-04 11:00:04,13,"b""Xu Xiang, a legend in China's booming stock market, became an emblem of financial corruption https://t.co/GoqcBMWvJP"""
716938376037928961,2016-04-04 10:40:03,9,"b'For R. Martin Chavez, a partner at Goldman Sachs, transparency is a personal credo https://t.co/EHuG2QhCBw https://t.co/XQahD9JUhD'"
716933353853829120,2016-04-04 10:20:06,16,b'Could driverless cars ease the traffic that plagues China? Some start-ups are banking on it. https://t.co/gacnxKaWQg https://t.co/JyuL6JyYqd'
716933056439967744,2016-04-04 10:18:55,2,"b'RT @prashantrao: As more news outlets move online, one British newspaper is betting readers are still keen on print - @_nicolaclark: https:\xe2\x80\xa6'"
716928316347957248,2016-04-04 10:00:05,3,"b'Workers in Indiana are turning away from President Obama, despite an economic recovery and low unemployment there https://t.co/rZu04B3u35'"
716923289185230853,2016-04-04 09:40:06,7,"b""A Brazilian senator details how corruption fueled his country's political crisis https://t.co/8Du9rVes8s https://t.co/a5rTCqBbPU"""
716918246721593344,2016-04-04 09:20:04,4,"b'A new Libor trial, a revised rescue plan for Puerto Rico and policy notes from the Fed in the week ahead https://t.co/gB6AvdgjRN'"
716913241411231746,2016-04-04 09:00:11,4,"b""One of the victims of Andrew Caspersen's investment scheme was a former classmate of his https://t.co/lctoeOGxRz https://t.co/Zq5CNHDGU7"""
716908948486496257,2016-04-04 08:43:07,6,"b'As people increasingly use smartphones and tablets, PC makers are fighting to stay relevant, @qhardy writes https://t.co/AdSn4nvmoh'"
716819342080548864,2016-04-04 02:47:03,9,"b'As print circulations keep falling ""...to launch a print-only product is really brave."" https://t.co/CHJV33f5QR https://t.co/twPTper5wS'"
716815070353866752,2016-04-04 02:30:05,1,"b""Get a head start on this week's business news https://t.co/esaMr5srPK https://t.co/8toYvYtOYz"""
716807527082696705,2016-04-04 02:00:06,10,b'Some argue that conditions in China are more favorable for quick adoption of driverless cars https://t.co/EcRZzlSYw7 https://t.co/eV7MJVVd3y'
716777337958834177,2016-04-04 00:00:09,22,b'The Powerpuff Girls are returning to Cartoon Network on Monday https://t.co/vkTa1jRpnd https://t.co/n3xiftDwXI'
716773797215531009,2016-04-03 23:46:04,4,"b'Outshone by smaller screens, PCs aim to be seen as cool again https://t.co/RP2UbtDUlT https://t.co/diOd8uZ7j7'"
716728750373732352,2016-04-03 20:47:04,12,"b'Chinese wine buyers listed on the bankruptcy claim they\xe2\x80\x99re owed more than $800,000. https://t.co/ioyGcAqOeg https://t.co/VIWOVD1FM1'"
716723726373494784,2016-04-03 20:27:07,7,b'\xe2\x80\x9cWe are all expected to attend many \xe2\x80\x98mandatory fun\xe2\x80\x99 events after work ... shelling out $50 to $200 a shot\xe2\x80\x9d https://t.co/8YRoDmRfqv'
716718174566236160,2016-04-03 20:05:03,7,"b'An interweaving of government, universities and corporations are merging textiles and tech https://t.co/wbj2zRfZZa https://t.co/4g7tWprYLH'"
716712127378157569,2016-04-03 19:41:01,11,b'A CEO\xe2\x80\x99s favorite question in job interviews: \xe2\x80\x9cWhat do you do on the weekends? What do you do in your spare time?\xe2\x80\x9d https://t.co/MbpKX5w8ZJ'
716707114425647105,2016-04-03 19:21:06,11,"b'A Gay, Latino Partner Tests Goldman\xe2\x80\x99s Button-Down Culture https://t.co/AkHogznUlz https://t.co/kNyGfcaOKD'"
716702588318720000,2016-04-03 19:03:07,10,b'Obama Gets Scant Credit in Indiana Region Where Recovery Was Robust https://t.co/mi7tGiGysp https://t.co/36JsZR4Ruy'
716697030048026626,2016-04-03 18:41:02,14,b'Guatemalan women\xe2\x80\x99s claims put focus on Canadian firms\xe2\x80\x99 conduct abroad https://t.co/q2HvaCmjPh https://t.co/t6ICRZ56bt'
716692264223944704,2016-04-03 18:22:05,4,"b'Mr. Baca, a model for romance novels, thrust his pelvis forward to ensure the ladies looked, well, you know, there. https://t.co/SLAI1Z9npQ'"
716687472533573634,2016-04-03 18:03:03,19,b'When major corporations come out in force against anti-LGBT laws https://t.co/WHHwk76gnp https://t.co/mwrg3BR6Vr'
716681434824646658,2016-04-03 17:39:04,24,"b'Combat uniforms that communicate and change color, signaling friend or foe: Textile and tech are merging https://t.co/B6GufIJz1G'"
716673896985006081,2016-04-03 17:09:06,4,b'Few will have sympathy for wealthy oenophiles crying over their spilled Margaux. https://t.co/QsZPr9SKyF https://t.co/KemT1d4ydj'
716671658619219969,2016-04-03 17:00:13,0,b'A threat from engineered stone countertops https://t.co/zfyyMmbCzc https://t.co/nspcdADToO'
716666338983460866,2016-04-03 16:39:04,27,b'The FBI is investigating claims of the largest-ever Ponzi scheme in the wine world. https://t.co/c9eRxX8ATE https://t.co/fjUzmoLbg8'
716658781350920192,2016-04-03 16:09:03,6,b'.@monkeyhelpers trains capuchin monkeys to assist people with limited mobility. https://t.co/bRDj0ii7Ya https://t.co/6ZVdx5hzVp'
716652232905781248,2016-04-03 15:43:01,26,b'\xe2\x80\x9cI don\xe2\x80\x99t like a culture where you have to have a meeting after the meeting to discuss what happened in the meeting.\xe2\x80\x9d https://t.co/YHVf0hN2fm'
716644947223556096,2016-04-03 15:14:04,7,"b'""I am so tired of looking at men\'s abs."" The romance novel editor\'s dilemma. https://t.co/kAkEzTnDwn https://t.co/1fR0vYfsuM'"
716641681450352642,2016-04-03 15:01:06,6,"b'Finding the best addiction treatment, with hired help https://t.co/x7jTsRm8fb https://t.co/QQg9kzmKkt'"
716633368776085504,2016-04-03 14:28:04,4,b'Guatemalan women\xe2\x80\x99s claims put focus on Canadian firms\xe2\x80\x99 conduct abroad https://t.co/b8fc3NrIpa https://t.co/4BGwfkuZPp'
716626343786594304,2016-04-03 14:00:09,13,"b'In places like Denver and Atlanta, there are signs of the economy getting back on track https://t.co/la4Al4MMY4 https://t.co/wsWobGNCrt'"
716620018960756736,2016-04-03 13:35:01,11,"b'After WikiLeaks Revelation, Greece Asks I.M.F. to Clarify Bailout Plan https://t.co/psYfQByvbc https://t.co/NGUNTNexoz'"
716608952897826816,2016-04-03 12:51:02,5,b'Addiction treatment is expensive. Consultants try to guide families https://t.co/gMpA1hSxYM https://t.co/aTZ4rBDzcK'
716603930378125312,2016-04-03 12:31:05,12,b'Alaska Airlines Said to Be Near $2 Billion Deal for Virgin America https://t.co/BggxqA6SNv https://t.co/lOou9YI64l'
716590592499781633,2016-04-03 11:38:05,14,"b""Transparency is a personal credo for Goldman's tech chief. At one start-up, he proposed posting everyone\xe2\x80\x99s salaries https://t.co/pu0tr0vnQy"""
716580790390403072,2016-04-03 10:59:08,13,"b""Goldman's tech chief is pushing the 147-year-old Wall Street bank to be more open, like him https://t.co/2zRNg0dSlg https://t.co/Wu47T4ITKh"""
716572960686010368,2016-04-03 10:28:01,8,b'A threat from engineered stone countertops https://t.co/RmrBLZ8FPu https://t.co/EmYF1gCzuh'
716557616709836804,2016-04-03 09:27:03,9,b'Complications in a \xe2\x80\x98revenge porn\xe2\x80\x99 case https://t.co/JEj4AtsLSj https://t.co/UPGYQ7FSAh'
716542761676226560,2016-04-03 08:28:01,14,"b'In places like Denver and Atlanta, there are signs of the economy getting back on track https://t.co/3oMh2O5YuE https://t.co/XsmGbLR6Re'"
716528173723344896,2016-04-03 07:30:03,18,"b'Slack, the workplace collaboration startup, raises $200 million in new venture funding. https://t.co/uatpk1gbUR https://t.co/byXe4gQwCj'"
716513320329682944,2016-04-03 06:31:02,2,"b'More Details on Banker\xe2\x80\x99s Tragic Death, but Questions Persist https://t.co/PZQeBNZk5D'"
716498215391125505,2016-04-03 05:31:01,6,"b'Facebook Live, annoying and intrusive, seems to be paying off https://t.co/ad18rmcLdE'"
716482881074380800,2016-04-03 04:30:05,9,b'.@monkeyhelpers trains capuchin monkeys to assist people with limited mobility. https://t.co/uaTUAGhpVV https://t.co/gFsWRJBAdJ'
716472560511291392,2016-04-03 03:49:04,7,b'Moving CD-ripped music from the computer to the iPad https://t.co/B5diMdgRnD'
716465777856135168,2016-04-03 03:22:07,5,b'\xe2\x80\x9cWe are all expected to attend many \xe2\x80\x98mandatory fun\xe2\x80\x99 events after work ... shelling out $50 to $200 a shot\xe2\x80\x9d https://t.co/FNEzYbKsOo'
716457960264826880,2016-04-03 02:51:03,5,"b""Video Review: Volvo's plug-in hybrid version of the XC90. It's powerful and not cheap https://t.co/nOHIJF5jnr https://t.co/L2nnaAIbSn"""
716452173593387008,2016-04-03 02:28:03,9,"b'Drug and alcohol addiction treatments are expensive, so some hire consultants to help https://t.co/LAicI04OwL https://t.co/fVdl2LeEU4'"
716446650361856000,2016-04-03 02:06:07,16,"b'As wine soars in value and transforms from status trophy into financial investment, it has become prone to fraud. https://t.co/GCR1eHQn3O'"
716441103122214912,2016-04-03 01:44:04,17,"b'Tesla aims this model for the mass market, and the masses respond https://t.co/TOC4zkFiR6 https://t.co/ikEBiGrXeq'"
716434047120109572,2016-04-03 01:16:02,10,b'Guatemalan women\xe2\x80\x99s claims put focus on Canadian firms\xe2\x80\x99 conduct abroad https://t.co/GyKMjAhXvx https://t.co/fOmiRrAJJD'
716428770564050944,2016-04-03 00:55:04,15,"b'After WikiLeaks Revelation, Greece Asks I.M.F. to Clarify Bailout Plan https://t.co/MQiTxvDrFK https://t.co/Rn5duJDVLS'"
716428268845531136,2016-04-03 00:53:04,12,b'Alaska Airlines Said to Be Near $2 Billion Deal for Virgin America https://t.co/FcsNSlRip5 https://t.co/aAmMtm1ZV4'
716421978115215360,2016-04-03 00:28:04,16,"b'After WikiLeaks Revelation, Greece Asks I.M.F. to Clarify Bailout Plan https://t.co/UVBZH03JgA https://t.co/SWtXVfRH2H'"
716416176541319172,2016-04-03 00:05:01,3,"b'Former Navy SEALs are appearing on red carpets, cable news shows and bookshelves. And it\xe2\x80\x99s causing a big debate. https://t.co/pYIFWHGPMJ\xe2\x80\xa6'"
716411161881755649,2016-04-02 23:45:05,18,b'\xe2\x80\x9cI don\xe2\x80\x99t like a culture where you have to have a meeting after the meeting to discuss what happened in the meeting.\xe2\x80\x9d https://t.co/SzzgwDhHV6'
716403601715933185,2016-04-02 23:15:03,2,b'Testing out apps on Apple\xe2\x80\x99s smaller devices https://t.co/EjjM3ClQ3C'
716400592260870145,2016-04-02 23:03:05,19,b'The list of victims is a who\xe2\x80\x99s who of wine collectors \xe2\x80\x93 from Silicon Valley billionaires to Wall St financiers. https://t.co/6iyv960B2X'
716396301689176064,2016-04-02 22:46:02,11,"b""Weighing whether to rent or buy? Here's our calculator: https://t.co/iciWMRvG80"""
716390018592464896,2016-04-02 22:21:04,20,"b'These fibers, from MIT, create fabric that is an optical bar code, to identify the wearer https://t.co/ywnqfRGyPk https://t.co/S2eW1HtdyK'"
716385242689482753,2016-04-02 22:02:06,3,"b'More Details on Banker\xe2\x80\x99s Tragic Death, but Questions Persist https://t.co/eylCJD82EA'"
716379955941273600,2016-04-02 21:41:05,7,"b'After WikiLeaks Revelation, Greece Asks I.M.F. to Clarify Bailout Plan https://t.co/2LHuYXC555 https://t.co/TfDfYyNCgM'"
716375917287890945,2016-04-02 21:25:02,9,b'A risqu\xc3\xa9 romance novel cover with male models sells three times more than with a woman alone https://t.co/fLpINGAs1E https://t.co/3ZlMufAX64'
716374401034371072,2016-04-02 21:19:01,3,"b""Have CD-ripped music? Here's how to get it onto the iPad https://t.co/JZkVNHQbVa"""
716371904257531909,2016-04-02 21:09:06,10,"b""He was a Minnesota Vikings player and a judge. What's his next career? https://t.co/FGUrp2MUe0 https://t.co/N5slP6e0OR"""
716369656085422080,2016-04-02 21:00:10,2,"b""Romance novel models are hot again. But there's no one quite like Fabio. https://t.co/FEcDkI8zuC https://t.co/uuycwja3zQ"""
716365612214304770,2016-04-02 20:44:06,6,b'\xe2\x80\x9cWe are all expected to attend many \xe2\x80\x98mandatory fun\xe2\x80\x99 events after work ... shelling out $50 to $200 a shot\xe2\x80\x9d https://t.co/B6EGcaZIeY'
716363428684759040,2016-04-02 20:35:25,48,b'RT @nytimesworld: Guatemalan women\xe2\x80\x99s claims put focus on Canadian firms\xe2\x80\x99 conduct abroad https://t.co/HvEiuPhqYz https://t.co/PvIhFnmAmP'
716358298283417601,2016-04-02 20:15:02,4,b'How did a 35-year-old wine store that became a favorite of the rich suddenly go bust? https://t.co/EvBxRo9SYF https://t.co/yaIgMLpzoD'
716355916350758912,2016-04-02 20:05:34,20,b'Alaska Airlines Said to Be Near $2 Billion Deal for Virgin America https://t.co/qxYYcNZukp https://t.co/xgO9nETxwG'
716353524183990272,2016-04-02 19:56:04,17,b'A CEO\xe2\x80\x99s favorite question in job interviews: \xe2\x80\x9cWhat do you do on the weekends? What do you do in your spare time?\xe2\x80\x9d https://t.co/g5DfikefmB'
716348746821459968,2016-04-02 19:37:05,12,b'Guatemalan women\xe2\x80\x99s claims put focus on Canadian firms\xe2\x80\x99 conduct abroad https://t.co/PwKAygAn3i https://t.co/HPNmUXmQHr'
716344959314563073,2016-04-02 19:22:02,34,b'\xe2\x80\x9cI don\xe2\x80\x99t like a culture where you have to have a meeting after the meeting to discuss what happened in the meeting.\xe2\x80\x9d https://t.co/wK8Hn8hxf4'
716342249546715136,2016-04-02 19:11:15,131,"b'RT @nytimes: Former Navy SEALs are appearing on red carpets, cable news shows and bookshelves. And it\xe2\x80\x99s causing a big debate. https://t.co/\xe2\x80\xa6'"
716338178710441984,2016-04-02 18:55:05,15,"b'After WikiLeaks Revelation, Greece Asks I.M.F. to Clarify Bailout Plan https://t.co/slbngzoU88 https://t.co/a3BxTGPtYA'"
716332394198994944,2016-04-02 18:32:06,11,"b'A Gay, Latino Partner Tests Goldman\xe2\x80\x99s Button-Down Culture https://t.co/VusLu3rVtc https://t.co/QYzXhe7yya'"
716327356814766080,2016-04-02 18:12:05,4,"b""This week in tech, @mikeisaac and @jwherrman talk about Facebook's Live Video efforts https://t.co/DgVnNDmmWx"""
716323827366629378,2016-04-02 17:58:03,3,"b'More Details on Banker\xe2\x80\x99s Tragic Death, but Questions Persist https://t.co/OU1Tad1kX8'"
716320315010363392,2016-04-02 17:44:06,29,b'The FBI is investigating claims of the largest-ever Ponzi scheme in the wine world. https://t.co/SoaTTcHkwx https://t.co/BZMGKekbhn'
716316811185233922,2016-04-02 17:30:10,8,"b""Goldman's tech chief is pushing the 147-year-old Wall Street bank to be more open, like him https://t.co/a7NDVZmIdM https://t.co/aJ0lNVdtNO"""
716312770145288192,2016-04-02 17:14:07,11,b'.@monkeyhelpers trains capuchin monkeys to assist people with limited mobility. https://t.co/7CIpJWIw2F https://t.co/l6GVJLabkl'
716309288558440448,2016-04-02 17:00:17,13,"b'In places like Denver and Atlanta, there are signs of the economy getting back on track https://t.co/P3VOi7zg9m https://t.co/hGckk2RhYl'"
716304543852662784,2016-04-02 16:41:26,528,"b'After WikiLeaks Revelation, Greece Asks I.M.F. to Clarify Bailout Plan https://t.co/X5otYxn4xg https://t.co/FxjE5vNWwz'"
716300932095598592,2016-04-02 16:27:05,3,b'A review of \xe2\x80\x98Saving the Media\xe2\x80\x99 https://t.co/RTsoN2aH5L'
716294704057487361,2016-04-02 16:02:20,2,"b'Bill Green, 91, Ombudsman Who Dissected Post Scandal  https://t.co/jzN0IyXpsI'"
716290070836326400,2016-04-02 15:43:55,5,"b'Eric Engberg, Newsman Who Led Political Segment on CBS, Dies at 74 https://t.co/0vgwTQDMKa'"
716284704501194752,2016-04-02 15:22:36,12,b'Which music-streaming service should you pay for? A look at the industry at a glance: https://t.co/DQbBoPVu2X https://t.co/hLrr6vcXlX'
716282806758989824,2016-04-02 15:15:03,6,b'A threat from engineered stone countertops https://t.co/pZx8gFVoAb https://t.co/y0IRksdFkk'
716279060616314884,2016-04-02 15:00:10,7,"b""Here's what to consider when deciding whether to rent or buy a home https://t.co/CKTCeuynZd https://t.co/bIKrHOt3D7"""
716271503348727809,2016-04-02 14:30:08,6,"b""Finding the interventions, with a consultant's help https://t.co/7i9q28kaP8 https://t.co/KdGZWPjrsY"""
716269247224262657,2016-04-02 14:21:10,21,"b'Improperly booking revenues, as Valeant did, sometimes results from stuffing the channel. https://t.co/g8mSMrLfkr https://t.co/OPryFbwOVq'"
716265061770260480,2016-04-02 14:04:32,33,"b'RT @deanemurphy: Marty Chavez of Goldman - gay, Latino &amp; transparent - is bent on refitting an old Wall Street car. Can he do it? https://t\xe2\x80\xa6'"
716264946707927040,2016-04-02 14:04:05,19,"b""RT @tarasbernard: Are long-time renters at a financial disadvantage? A look at the rent versus buy conundrum in this week's column: https:/\xe2\x80\xa6"""
716264196632141824,2016-04-02 14:01:06,10,"b""Weighing whether to rent or buy? Here's our calculator: https://t.co/CIvzrhJisc"""
716236760410374145,2016-04-02 12:12:05,7,b'What you need to know about the 1095 tax form for health care coverage https://t.co/9Bx2UgQHzI'
716226500102602752,2016-04-02 11:31:19,7,b'\xe2\x80\x9cWhen you\xe2\x80\x99re in a meeting and you can tell someone doesn\xe2\x80\x99t want to be there. It\xe2\x80\x99s likely something you did.\xe2\x80\x9d https://t.co/lx2TlIYWt5'
716150413037322240,2016-04-02 06:28:58,22,b'Have you had a meeting after a meeting to discuss what happened in the previous meeting? https://t.co/KfDtd9jokb https://t.co/RYevOkbdRH'
716145255708508160,2016-04-02 06:08:28,7,"b""Here's the latest to join a growing list of scuttled mergers in the European telecoms industry https://t.co/zg5g0xiJw8"""
716140005085855744,2016-04-02 05:47:37,4,"b""RT @adriennecarter: the obscure phrase in chinese regulation that may have derailed anbang's deal for starwood. by @KeithBradsher \n\nhttps:/\xe2\x80\xa6"""
716134696627933184,2016-04-02 05:26:31,5,b'RT @LizziePaton: Short-termism is an attitude problem coming from designers as well as executives ---&gt;Hedi Slimane\xe2\x80\x99s Dangerous Legacy https\xe2\x80\xa6'
716129354577797120,2016-04-02 05:05:17,5,b'RT @kemcke: New scrutiny of the silicosis risk to workers in making quartz countertops. @BarryMeier reports.  https://t.co/ZH5ngcDkLN'
716124078478921728,2016-04-02 04:44:19,4,b'.@notrobwalker wishes that companies would think more carefully about the oxymoronic category of \xe2\x80\x9cmandatory fun.\xe2\x80\x9d https://t.co/qjjtO9oMSD'
716118778166292480,2016-04-02 04:23:16,2,"b'RT @koblin: The Hedi Slimane Saint Laurent legacy: Hated by critics, adored by retailers and rock stars, by @MatthewSchneier https://t.co/o\xe2\x80\xa6'"
716113434820083712,2016-04-02 04:02:02,5,b'RT @MattGoldstein26: Could K&amp;LGates revenge porn lawsuit take a detour after prosecutors toss out related criminal case https://t.co/L7MwHu\xe2\x80\xa6'
716095329364492289,2016-04-02 02:50:05,5,b'When the fun is mandatory \xe2\x80\x93 and you\xe2\x80\x99re helping pay for it. The Workologist:  https://t.co/MKDI0IyUzq https://t.co/1gqdfEovQN'
716090295205642240,2016-04-02 02:30:05,5,b'A Chinese phrase adds mystery to Anbang\xe2\x80\x99s about-face on Starwood https://t.co/btVooTgxlj https://t.co/7vV1JZNUWW'
716082778526318592,2016-04-02 02:00:13,89,"b'Customers are putting down $1,000 deposits for Tesla\xe2\x80\x99s 2017 electric model https://t.co/iZ54h6obpc https://t.co/wQSrMUtvAU'"
716078977383837696,2016-04-02 01:45:06,5,b'Another European telecom merger falters over antitrust https://t.co/3ky1zIuDd3'
716074937845460993,2016-04-02 01:29:03,7,b'Gmail users not amused by Minion characters literally dropping a microphone.https://t.co/5wdA356BQ4 https://t.co/lHwCAIlZKe'
716071419189272576,2016-04-02 01:15:04,11,"b""Here's what to consider when deciding whether to rent or buy a home https://t.co/wUqwdLt6om https://t.co/XKvdfKjKyc"""
716067694722826240,2016-04-02 01:00:16,4,b'A Chinese phrase adds mystery to Anbang\xe2\x80\x99s about-face on Starwood https://t.co/eJYNkkbWxn https://t.co/IvGCkF1s6m'
716061355191713792,2016-04-02 00:35:05,4,"b""He was a Minnesota Vikings player and a judge. What's his next career? https://t.co/QMuWNvjr0O https://t.co/cQzn8r1ZnC"""
716057572680269824,2016-04-02 00:20:03,6,b'Ublester Rodriguez was exposed to silica dust working with countertops. Now he has silicosis https://t.co/r3IHajAnC6 https://t.co/mLZ5XhWBhi'
716053807151624193,2016-04-02 00:05:05,5,"b""Video Review: Volvo's plug-in hybrid version of the XC90. It's powerful and not cheap https://t.co/UD2xH2k0Sr https://t.co/6vNypFlthA"""
716050043845869569,2016-04-01 23:50:08,21,"b'These fibers, from MIT, create fabric that is an optical bar code, to identify the wearer https://t.co/qPpjNYwTQG https://t.co/4Qbm3M6o4f'"
716046250739630080,2016-04-01 23:35:04,11,"b'Drug and alcohol addiction treatments are expensive, so some hire consultants to help https://t.co/OHjnbZTben https://t.co/YvhL79yfB7'"
716042476218359808,2016-04-01 23:20:04,6,b'Your Money Adviser: Beware these student-debt relief firms https://t.co/Sj1jWnGpRF'
716038702057840640,2016-04-01 23:05:04,12,"b'Tesla aims this model for the mass market, and the masses respond https://t.co/Ujfdxaybnz https://t.co/l2WdR9j6r6'"
716034919672188936,2016-04-01 22:50:02,11,b'This start-up hires its cleaners as full- and part-time employees -- and provides benefits https://t.co/7jerU9uQbj'
716030138195046400,2016-04-01 22:31:02,4,"b'""I am so tired of looking at men\'s abs."" The romance novel editor\'s dilemma. https://t.co/YLSidQth9M https://t.co/5mtxKfBrEv'"
716026123264634885,2016-04-01 22:15:05,2,b'Pabst\xe2\x80\x99s new owner digs into old recipes as it looks to the future https://t.co/0luK4JDJ6x https://t.co/UtG1rlXEOM'
716022396331941888,2016-04-01 22:00:16,3,"b'For the poor, a $9.25/month broadband subsidy https://t.co/9DiyGQGmof'"
716020827456667651,2016-04-01 21:54:02,10,"b'Slack, the workplace collaboration startup, raises $200 million in new venture funding. https://t.co/utEq1hwPxb https://t.co/jUakjIIrBI'"
716018570841493504,2016-04-01 21:45:04,5,b'Popular counter tops tied to outbreaks of silicosis in workers https://t.co/i9gqOd002Z https://t.co/Re6Evwxtdd'
716014798245335040,2016-04-01 21:30:05,3,"b'In places like Denver and Atlanta, there are signs of the economy getting back on track https://t.co/fOUBuFguef https://t.co/toHB2hmUxI'"
716012571099267072,2016-04-01 21:21:14,8,"b""RT @tarasbernard: Are long-time renters at a financial disadvantage? A look at the rent versus buy conundrum in this week's column: https:/\xe2\x80\xa6"""
716011026240684034,2016-04-01 21:15:06,3,b'\xe2\x80\x9cWe are all expected to attend many \xe2\x80\x98mandatory fun\xe2\x80\x99 events after work ... shelling out $50 to $200 a shot\xe2\x80\x9d https://t.co/PTiOozIR9w'
716007488978608128,2016-04-01 21:01:02,105,"b""Weighing whether to rent or buy? Here's our calculator: https://t.co/uXZE9hN90G"""
716007309911199744,2016-04-01 21:00:20,8,"b""Being in the closet helped convince Goldman's tech chief on the importance of transparency. https://t.co/R60fVFCRyI https://t.co/xdl6SisfUl"""
716007276356702208,2016-04-01 21:00:12,5,"b""Here's what to consider when deciding whether to rent or buy a home https://t.co/NachPSDweJ https://t.co/UfEq9LAWQv"""
716002208773455872,2016-04-01 20:40:03,6,b'Lawyers account for less than half of the jobs in legal services  https://t.co/FSkBQQYQ21'
716000336817815553,2016-04-01 20:32:37,87,b'RT @greenhousenyt: How a $15 minimum wage went from being laughed at 3 years ago to being adopted by 2 of the biggest states. My Story: htt\xe2\x80\xa6'
715997181048721408,2016-04-01 20:20:05,7,b'The complications of a \xe2\x80\x98revenge porn\xe2\x80\x99 lawsuit https://t.co/ewelcLjgGC'
715993391666999296,2016-04-01 20:05:01,1,b'View: The reasons behind stagnation in legal jobs https://t.co/4rPoWVa4Ff'
715989206598860804,2016-04-01 19:48:23,8,"b'Facebook Live, annoying and intrusive, seems to be paying off https://t.co/gkohikwhX9'"
715989128190562305,2016-04-01 19:48:05,6,b'The way carmakers count auto sales is raising questions https://t.co/BSP1YjLhUR https://t.co/k4vYyBXnSt'
715988741756743680,2016-04-01 19:46:33,11,b'RT @LesliePicker: An IPO standoff only seen during the darkest days for tech companies. https://t.co/MCMlvqWAAQ'
715987649190883328,2016-04-01 19:42:12,9,"b'RT @UpshotNYT: Unemployment, city by city, in one great chart. https://t.co/Mpg8Q8ETsj https://t.co/s8yPT9CKy7'"
715986859478937600,2016-04-01 19:39:04,3,b'Complications in a \xe2\x80\x98revenge porn\xe2\x80\x99 case https://t.co/GRYy62wSGC https://t.co/JBtbuUBzMb'
715985100509421568,2016-04-01 19:32:04,7,"b'In places like Denver and Atlanta, there are signs of the economy getting back on track https://t.co/rGXaUxab3J https://t.co/qEpj9Wkvn3'"
715982086377701377,2016-04-01 19:20:06,5,b'Why a Chinese phrase tripped up the Starwood merger deal https://t.co/O4JSltMj4x'
715980821870616576,2016-04-01 19:15:04,7,b'An explosion of data changed how we market products and politicians. Now it is changing how we combat poverty. https://t.co/hKXDJ8pjz3'
