b'id',b'created_at',b'retweet_count',b'text'
723308357088632833,2016-04-22 00:32:05,1,"b""Univision Buys Disney's Stake in Fusion, Planning a Media Group for Young, Diverse Audiences.  https://t.co/8Mv4IQLbkR"""
723306090763526144,2016-04-22 00:23:05,10,b'Only 15 to 30 percent of those who could benefit from hearing aids use them. https://t.co/amSsWGno2h'
723300334064553984,2016-04-22 00:00:12,1,"b""As part of new deal, Viacom content will be added to Dish's Sling TV streaming service https://t.co/IbdJoSMThu https://t.co/6IUBPqL544"""
723298788643889152,2016-04-21 23:54:04,7,"b""F.B.I. Director Suggests Agency Spent $1.3 Million to Hack Into Killer's iPhone https://t.co/FJln4oWWaU https://t.co/pWdrFm2jMG"""
723296530619334656,2016-04-21 23:45:05,2,"b""Dude, where's my Pulitzer? https://t.co/4bMGdGhYPn"""
723292772040622080,2016-04-21 23:30:09,8,b'Mitsubishi technical facility scrutinized by government investigators https://t.co/RYAv0VNemK https://t.co/zyiJkvC4bY'
723288975130112000,2016-04-21 23:15:04,3,b'Moving PDFs to a PC from an iPad https://t.co/HvjdIxV8Rk https://t.co/Mz6DdOjgYd'
723286195447431169,2016-04-21 23:04:01,4,b'Dish wanted its MTV after all. https://t.co/5ofPvGx0rr https://t.co/tHcF6WxwdF'
723281434048389120,2016-04-21 22:45:06,8,b'A crucial measure of Google\xe2\x80\x99s advertising business fell 9%  https://t.co/3FrgTxKFhP https://t.co/eDJ7yH6eqE'
723281170281172992,2016-04-21 22:44:03,5,"b'The old adage that if it sounds too good to be true, it probably is, may be the case here. https://t.co/w4rQzsn5zu https://t.co/peSwSHQwXL'"
723279170030190592,2016-04-21 22:36:06,3,b'Univision buys out Disney\xe2\x80\x99s stake in Fusion https://t.co/gsMxd1GcSP'
723277398058385408,2016-04-21 22:29:04,3,b'What platforms want from online media https://t.co/Ar12ZNKS4A'
723274876837060609,2016-04-21 22:19:03,9,"b'Volkswagen agreed this morning to fix or buy back nearly 500,000 diesel cars in the U.S. https://t.co/MSoT8B1STr https://t.co/ITEzuXfYu8'"
723272878779686913,2016-04-21 22:11:06,7,b'Two corporate powers dominate the booming concert industry. One of them is about get bigger. https://t.co/qFqFxXszCf https://t.co/wcvEq51sLW'
723266338668580864,2016-04-21 21:45:07,6,b'Proposed rules to claw back bonuses from bank executives over problem behavior.  https://t.co/UF9dNk5UpH https://t.co/ZrVseHgahH'
723261735730290688,2016-04-21 21:26:50,4,b'When a platform comes to town https://t.co/MVoqFNFLjg'
723258398620430337,2016-04-21 21:13:34,9,"b""Alphabet's earnings miss forecasts, as a key Google ad metric stumbles https://t.co/a974Csps2C https://t.co/7UB1oroMnM"""
723257693067173888,2016-04-21 21:10:46,5,"b""Microsoft's sales and profit slipped in 3rd quarter https://t.co/gj4BUeWACi"""
723255480563437568,2016-04-21 21:01:58,12,b'Theranos is being investigated by Justice Dept &amp; SEC. What potential violations might be the subject of the inquiry? https://t.co/f9aMrQcqkn'
723251246874918912,2016-04-21 20:45:09,7,b'Regulators (finally) propose revised rules to restrict Wall Street pay. https://t.co/jJpUwRRTA4 https://t.co/jiHvnuIcND'
723248967484641280,2016-04-21 20:36:05,6,b'What does it mean to dress like a banker in the age of Bernie Sanders? https://t.co/GZesoBBYbw'
723243834579279872,2016-04-21 20:15:42,25,b'Why aren\xe2\x80\x99t venture capital firms suing the blood-testing company Theranos? https://t.co/0yVPnk5zdP https://t.co/ePmS13B8KL'
723240648460099585,2016-04-21 20:03:02,10,b'Two corporate powers dominate the booming concert industry. One of them is about get bigger. https://t.co/gg0pCnXm5u https://t.co/rTd5baTajN'
723237131737505793,2016-04-21 19:49:03,4,b'A deal is brewing that would turn the NYC concert market into a battleground between AEG and Live Nation https://t.co/6JCbGl2iUr'
723232388508205056,2016-04-21 19:30:13,5,b'Today the F.D.A. is discussing whether to relax the rules for hearing aids. https://t.co/0uSYKuJ9D1 https://t.co/DsBl5sMg1b'
723228333719334913,2016-04-21 19:14:06,4,b'Unease in the once-happy land of \xe2\x80\x9cLive.\xe2\x80\x9d https://t.co/UQj09KeJGH https://t.co/Nwvb1cHJY6'
723224816204038145,2016-04-21 19:00:07,5,"b'After the Pulitzers were announced on Monday, a Florida paper just found out it has another honoree https://t.co/CY9z3ju618'"
723221051476443136,2016-04-21 18:45:10,6,b'Regulators (finally) propose revised rules to restrict Wall Street pay. https://t.co/bLnxw5HQWp https://t.co/fjuaxc8dfu'
723214748360314880,2016-04-21 18:20:07,5,"b""Dish and Viacom deal prevents blackout of Viacom networks for Dish's 14 million customers https://t.co/DZ3UXTjq7o https://t.co/JkwpA9nWUn"""
723211459849760768,2016-04-21 18:07:03,6,"b'The European Central Bank is likely to assess its recent moves, while weighing next steps. https://t.co/DF3w02wejS https://t.co/M0boGEicpr'"
723209444704833540,2016-04-21 17:59:02,0,"b""We talked to one of the few people who might know what Facebook's power means for media https://t.co/DBCWO8ORwW"""
723206942529863680,2016-04-21 17:49:06,3,b'Government aims new pay rules at many in banking industry. https://t.co/DjX1POjFLM https://t.co/fjwR0jSNg7'
723203667302715392,2016-04-21 17:36:05,3,b'Theranos had many enablers before its blood test fiasco. None more crucial than Walgreens. https://t.co/sznJWNtCxV https://t.co/6YxNeoGtJ6'
723196439355109380,2016-04-21 17:07:22,5,"b""RT @josephplambeck: What will happen to online media in the Facebook era? Here's a Q&amp;A with one of the few people who might know. https://t\xe2\x80\xa6"""
723194267599036416,2016-04-21 16:58:44,1,b'RT @JackEwingNYT: E.C.B. takes a policy breather after major moves last month https://t.co/oSirGbURDW'
723188650578731008,2016-04-21 16:36:25,7,"b'RT @BCAppelbaum: New currency: ""A powerful and necessary realignment of our symbols and our professed values."" https://t.co/Umd4eX6HCQ'"
723183290212061184,2016-04-21 16:15:07,2,b'Unease in the once-happy land of \xe2\x80\x9cLive.\xe2\x80\x9d https://t.co/65vW4PHlyC https://t.co/jzSL1C5YkX'
723181238513721348,2016-04-21 16:06:57,7,"b'VW agrees to a U.S. settlement, but its diesel-cheating troubles are far from over. https://t.co/y9YLW9IOvd https://t.co/UD4VJor2VW'"
723179267123777536,2016-04-21 15:59:07,5,b'Two corporate powers dominate the booming concert industry. One of them is about get bigger. https://t.co/HEOB5VX1qS https://t.co/BOjf03VNMe'
723176234025385988,2016-04-21 15:47:04,7,b'The consumer electronics industry is moving in on the hearing-aid business https://t.co/3LhBiOwCzN https://t.co/vKBqMDcnsw'
723173946703618048,2016-04-21 15:37:59,9,"b""RT @emilysteel: Dish + Viacom agree to multi-year renewal. That mean Dish's 14m customers won't see a blackout. Viacom networks also added\xe2\x80\xa6"""
723173352689524736,2016-04-21 15:35:37,18,b'Theranos had many enablers before its blood test fiasco. None more crucial than Walgreens. https://t.co/nebpjA8u1r https://t.co/Oh32hkOiLN'
723171135391715328,2016-04-21 15:26:49,8,b'RT @LesliePicker: Verbs used to describe Wall Street revenue/earnings in this recap: https://t.co/5KHFvfMMay\nFall\nDecline\nPlummet\nTumble\nPl\xe2\x80\xa6'
723169981563830272,2016-04-21 15:22:14,3,b'RT @prashantrao: What happens to a firm built around a star when the star dies? Great by @StevenErlanger about Zaha Hadid Architects https:\xe2\x80\xa6'
723166756064387072,2016-04-21 15:09:25,7,"b'SunEdison, which became a giant of renewable energy, has filed for bankruptcy protection Thursdayhttp://nyti.ms/1pl7WMD'"
723163648894599168,2016-04-21 14:57:04,5,b'Viacom\xe2\x80\x99s woes may deepen in its standoff with Dish Network https://t.co/gA4BRpf7wt https://t.co/FUZNM5aAsM'
723160374367948800,2016-04-21 14:44:03,3,"b""Dude, where's my Pulitzer? https://t.co/DpfX9cjlIc"""
723156888381173760,2016-04-21 14:30:12,12,b'Today the F.D.A. is discussing whether to relax the rules for hearing aids. https://t.co/i5T5rL9cdk https://t.co/O42hv2dwDl'
723154836200542212,2016-04-21 14:22:03,6,"b'RT @peterjhenning: With the Deal Professor @StevenDavidoff taking a look at Theranos investigations, and what it means for unicorns. https:\xe2\x80\xa6'"
723149057368199169,2016-04-21 13:59:05,1,b'A deal is brewing that would turn the NYC concert market into a battleground between AEG and Live Nation https://t.co/alkqQsS0pg'
723146528307699712,2016-04-21 13:49:02,4,b'\xe2\x80\x9cThe M.&amp;A. cycle is never a straight line\xe2\x80\x9d https://t.co/CrKwLFz3FT'
723142750456127488,2016-04-21 13:34:01,4,b'The consumer electronics industry is moving in on the hearing-aid business https://t.co/WAEvJrCsTS https://t.co/yI8xuMuWgu'
723139237185462272,2016-04-21 13:20:04,2,b'E.U. antitrust officials have charged Google with unfairly using Android to promote its services https://t.co/pV51s6FyMS'
723137744139108352,2016-04-21 13:14:08,2,b'A 77% decline in net income for the first quarter https://t.co/CwAP6e2ljU'
723134285188857856,2016-04-21 13:00:23,2,b'Mitsubishi said it had cheated on fuel-economy tests for an ultrasmall car produced in Japan https://t.co/sZR8myckBf https://t.co/pKx3MLzfM1'
723133947643867136,2016-04-21 12:59:02,6,b'RT @vindugoel: Will the Down To Lunch app be the next Snapchat? Or the next Yo? https://t.co/OCIZfEaJ1j'
723130184443027456,2016-04-21 12:44:05,4,b'It can be a blessing and a curse for food entrepreneurs to get noticed by Whole Foods https://t.co/q4P1dCCjcK https://t.co/PmIrV6OPot'
723125153211781120,2016-04-21 12:24:06,6,b'We upgrade our gadgets every couple of years. But is that just consumerism run amok? https://t.co/NFI6dvP2fm https://t.co/UWqvc0Ksvn'
723120114019762176,2016-04-21 12:04:04,6,"b'Iran\xe2\x80\x99s central bank must pay nearly $2 billion to victims of terrorist attacks, U.S. Supreme Court rules https://t.co/wPairwtpcR'"
723117846168014849,2016-04-21 11:55:04,6,"b'Your $5, $10 and $20 bills are changing. A great conversation on what it all means: https://t.co/G9veIb4zzb'"
723116717459791874,2016-04-21 11:50:34,12,"b'RT @prashantrao: #BREAKING The ECB has decided to stand pat on interest rates and monetary stimulus, @JackEwingNYT reports: https://t.co/cV\xe2\x80\xa6'"
723115085770690560,2016-04-21 11:44:05,2,b'Unease in the once-happy land of \xe2\x80\x9cLive.\xe2\x80\x9d https://t.co/m75VZtCa6Y https://t.co/IM5zzstaHX'
723112568177483776,2016-04-21 11:34:05,4,b'The perils of having the hottest social app in town https://t.co/T1xypwBYdU https://t.co/msRUt31V3I'
723110034331295744,2016-04-21 11:24:01,0,"b'Judge Charles R. Breyer once aspired to take center stage. Thanks to Volkswagen, he will. https://t.co/CDIOhKdXJZ https://t.co/KAcCKTq9Gh'"
723107228169981952,2016-04-21 11:12:52,4,"b""Dude, where's my Pulitzer? https://t.co/cBByM6FLWw"""
723105014143705088,2016-04-21 11:04:04,7,"b'Younger consumers are among those hardest hit by bank overdraft fees in the U.S., Pew Charitable Trusts reports https://t.co/YB6dMFfryo'"
723099970602164224,2016-04-21 10:44:02,5,b'Curt Schilling has been fired from ESPN over his comments about transgender people https://t.co/k6pvtcY2dx https://t.co/qFBwzJ0iKc'
723094954885713920,2016-04-21 10:24:06,7,b'The founders of Down to Lunch confront the perils of having the hottest social app in town https://t.co/I3bgquzke6 https://t.co/rahaPAIDjL'
723090815598342144,2016-04-21 10:07:39,1,"b""RT @prashantrao: A deal on @VW's #DieselGate emissions cheating in the US is expected today, @JackEwingNYT reports: https://t.co/6SPVrt0O8Q"""
723089908781469701,2016-04-21 10:04:03,26,b'The abolitionist Harriet Tubman will replace the slaveholder Andrew Jackson on the $20 bill https://t.co/OsLJTiSQpJ https://t.co/jseAGQAC73'
723084880930824192,2016-04-21 09:44:04,8,b'Japanese regulators are investigating Mitsubishi after the company admitted to cheating on fuel-economy tests https://t.co/DM7MRdKXmf'
723079839503278080,2016-04-21 09:24:02,7,"b'This #EarthDay, be an anti-consumer. Skip buying a new iPhone or Android with these tips. https://t.co/w8HFiC3HBd https://t.co/rsZBONadZm'"
723074822390054912,2016-04-21 09:04:06,11,b'Volkswagen is close to sealing a deal to resolve claims in the U.S. over emissions tests https://t.co/A8piIvwRTX https://t.co/Xg5ZAS1CHL'
723073083754553344,2016-04-21 08:57:11,386,"b""RT @nytimes: Here's the lineup of new faces on the $5, $10 and $20 bills https://t.co/jS7CPzW0iW https://t.co/pBqx5NdEA2"""
723069787493019648,2016-04-21 08:44:05,7,"b'Theranos, a blood-testing company, could find itself swamped as it faces a series of investigations https://t.co/JQXUwyStIW'"
723064754017845248,2016-04-21 08:24:05,7,"b""The guys behind the No. 2 free iPhone app don't want your venture capital. https://t.co/W6ZN8lVNfC https://t.co/E5Ni0ozVif"""
723060372194906112,2016-04-21 08:06:41,4,b'Ad agencies need young talent. Cue the beanbag chairs. https://t.co/YHDkQWUeEU https://t.co/XPDPV7M8Fo'
723054685523992577,2016-04-21 07:44:05,3,"b""Kelly Ripa is playing hooky from her show for the rest of the week, in a fit of pique over her co-host's departure. https://t.co/vhe6OGJsI5"""
723049679617949696,2016-04-21 07:24:11,7,"b'The ""Whole Foods effect"" is great for a business. Until it has to scale up. https://t.co/wUsSPRP92Z https://t.co/hdrXbMHTfK'"
723036385821757440,2016-04-21 06:31:22,2,"b'Why this might be a day of reconnoitering for Mario Draghi.\n\nE.C.B. Expected to Stand Pat, but Explore Next Options, via @nytimes'"
723034442541969408,2016-04-21 06:23:39,8,b'Japanese regulators pay visit to Mitsubishi technical facility https://t.co/7FwyJ9AmmB https://t.co/9pfWfM0jUW'
722998727066157056,2016-04-21 04:01:43,5,b'RT @puiwingtam: Europe v Google on Android - a fine pair of stories by @markscott82 this week. \nhttps://t.co/71nQMigXKd + https://t.co/2Uhx\xe2\x80\xa6'
722992011658309633,2016-04-21 03:35:02,8,b'Brian Gleason was thrilled his former paper had won a Pulitzer. Then he realized it had won on his writings... https://t.co/4EMugdfWIs'
722983252982697984,2016-04-21 03:00:14,8,b'We upgrade our gadgets every couple years. But is that just consumerism run amuck? https://t.co/YEByTPZAj7 https://t.co/CaKW8kuGFT'
722983231822397440,2016-04-21 03:00:09,2,b'The founders of Down to Lunch confront the perils of having the hottest social app in town https://t.co/7tQhtTImLi https://t.co/FeW6Ex6JLu'
722975686521196544,2016-04-21 02:30:10,10,"b'This #EarthDay, be an anti-consumer. Skip buying a new iPhone or Android with these tips. https://t.co/5JYwJKrkFK https://t.co/GWGEcA15ny'"
722972648272211968,2016-04-21 02:18:06,7,"b'When Nissan raised concerns about fuel efficiency results, Mitsubishi admitted to cheating. https://t.co/TlWtpSRwCn https://t.co/mfIQDNBAV3'"
722968115940855808,2016-04-21 02:00:05,11,"b""When Whole Foods wants to stock the delectable you've perfected, it's great \xe2\x80\x94 and scary. https://t.co/FGpXxy6xwd https://t.co/bOAOMOMqiG"""
722961813235748864,2016-04-21 01:35:02,8,"b""The guys behind the No. 2 free iPhone app don't want your venture capital. https://t.co/htxNOa2qFv https://t.co/F0PW6Q0Icg"""
722960568647311360,2016-04-21 01:30:06,5,"b""Kelly Ripa is playing hooky from her show for the rest of the week, in a fit of pique over her co-host's departure. https://t.co/PFqTukXcBx"""
722955032853880832,2016-04-21 01:08:06,7,"b'The ""Whole Foods effect"" is great for a business. Until it has to scale up. https://t.co/iRgpjRIVwr https://t.co/X6U0ho8r78'"
722948775925420032,2016-04-21 00:43:14,21,"b""RT @puiwingtam: How to break the cycle of constantly upgrading your gadgets when you don't need to. New Tech Fix from @bxchen\nhttps://t.co/\xe2\x80\xa6"""
722942932920233985,2016-04-21 00:20:01,5,b'Watching the clock on that Windows 10 deal https://t.co/wSi2fUxdrG'
722939161611776000,2016-04-21 00:05:02,9,b'The maker of Cocoa Puffs created a venture capital unit that invested in a start-up for kale chips &amp; broccoli crisps https://t.co/Uk4Rcq0gwn'
722932375349501952,2016-04-20 23:38:04,30,"b'Banks made $32.5 billion from overdraft fees last year, much of it paid by young adults https://t.co/Y4MBzTRX2p'"
722930488357351424,2016-04-20 23:30:34,3,"b""RT @jimrutenberg: Is Madison Ave's struggle to refresh ranks w/young new recruits death knell for 30 sec ad? @melbournecoal reports! https:\xe2\x80\xa6"""
722924561432449024,2016-04-20 23:07:01,6,b'Sumner Redstone\xe2\x80\x99s granddaughter is now joining the battle over his mental competency https://t.co/kLFmf9IsKs'
722922861275574272,2016-04-20 23:00:16,9,b'The founders of Down to Lunch confront the perils of having the hottest social app in town https://t.co/kMbQHJCqjZ https://t.co/oiUfP0ZM1i'
722916023171682304,2016-04-20 22:33:05,10,b'Mitsubishi says it cheated on fuel-economy tests for a popular microcar it sells in Japan. https://t.co/BddDOEei9F https://t.co/vQn2O0vLRu'
722912773311582209,2016-04-20 22:20:10,4,b'Brian Gleason was thrilled his former employer had won a Pulitzer. Then he realized it had won on his writings... https://t.co/pCQBDDO4UZ'
722909716012081154,2016-04-20 22:08:01,6,"b'The ""Whole Foods effect"" is great for a business. Until it has to scale up. https://t.co/N3ykvCnSht https://t.co/cQCz8maepI'"
722907759675441153,2016-04-20 22:00:15,5,"b'This #EarthDay, be an anti-consumer. Skip buying a new iPhone or Android with these tips. https://t.co/zs9u2WQRWR https://t.co/q6HBuMzlyZ'"
722907735214284800,2016-04-20 22:00:09,6,"b""When Whole Foods wants to stock the delectable you've perfected, it's great \xe2\x80\x94 and scary. https://t.co/uPPrxuqZ9j https://t.co/iYG2xGPWmC"""
722903431736758273,2016-04-20 21:43:03,4,b'The Senate this morning passed the first broad energy bill since the George W. Bush administration  https://t.co/HT88NMtyYO'
722902692218019840,2016-04-20 21:40:07,12,b'We upgrade our gadgets every couple years. But is that just consumerism run amuck? https://t.co/0vd1G792rT https://t.co/xd4NsdlEYp'
722897142528933889,2016-04-20 21:18:04,3,b'Sumner Redstone\xe2\x80\x99s granddaughter is taking on her aunt in the legal battle over his mental competancy https://t.co/p5nQuRPQAF'
722894467376676865,2016-04-20 21:07:26,12,b'RT @UpshotNYT: How tracking medical devices could help problems be noticed sooner.\nhttps://t.co/NBjO29XGt1 https://t.co/xWhyqQzXGW'
722894369695531008,2016-04-20 21:07:03,5,"b""It's not just money that can keep food entrepreneurs from expanding rapidly. https://t.co/MebLIAwRpW https://t.co/GdcboFsVa5"""
722891845970231296,2016-04-20 20:57:01,8,"b""After a rough quarter, the questions are mounting over Goldman Sachs's direction  https://t.co/POPnqX4r5f https://t.co/tE6f8zO31R"""
722889838647640064,2016-04-20 20:49:02,3,b'Customers and retailers may have one less reason to dislike new chip-enabled credit cards https://t.co/sxVGzDOLg2 https://t.co/2UPkWfTIIB'
722889355635785729,2016-04-20 20:47:07,13,"b'Iran\xe2\x80\x99s central bank must pay nearly $2 billion to victims of terrorist attacks, U.S. Supreme Court rules https://t.co/25g6GOksJS'"
722887379330031617,2016-04-20 20:39:16,7,"b""RT @puiwingtam: The tale of Down To Lunch, the top free social app on the iPhone. Staying there won't be easy. https://t.co/1vq7Ar6wAX via\xe2\x80\xa6"""
722886581044940800,2016-04-20 20:36:06,27,"b'Banks made $32.5 billion from overdraft fees last year, much of it paid by young adults https://t.co/TORPj6vMRz'"
722884069315338240,2016-04-20 20:26:07,99,b'RT @nytimes: How Medicare penalizes hospitals for being too careful https://t.co/r2LvBWlie4 https://t.co/nWWuOmbPNz'
722879030870024192,2016-04-20 20:06:06,7,b'Mitsubishi admits it cheated on fuel-economy tests on a popular microcar sold in Japan. https://t.co/ONel811wsl https://t.co/7faTerHkAw'
722874657209217025,2016-04-20 19:48:43,2,b'Watching the clock on that Windows 10 deal https://t.co/wVkQPiHEga'
722871247936335872,2016-04-20 19:35:10,8,b'Consumer demand for local foods is driving these entrepreneurs. https://t.co/wnESz74C1D https://t.co/Dld3c1kK2k'
722864965544251392,2016-04-20 19:10:12,8,b'Mitsubishi says it cheated on fuel-economy tests in the latest auto-industry black eye. https://t.co/xtz6Lzdqur https://t.co/PKZF1DMqtT'
722859159436320768,2016-04-20 18:47:08,10,"b'Iran\xe2\x80\x99s central bank must pay nearly $2 billion to victims of terrorist attacks, U.S. Supreme Court rules https://t.co/WgieE2VrWC'"
722856882642239488,2016-04-20 18:38:05,17,"b'Banks made $32.5 billion from overdraft fees last year, much of it paid by young adults https://t.co/03m62VmMSL'"
722856366906417152,2016-04-20 18:36:02,2,b'RT @Jeffrey_Cane: The friendly skies of activism -- United Continental reaches a deal on board with 2 investment firms. https://t.co/kHPssH\xe2\x80\xa6'
722854123008344064,2016-04-20 18:27:07,43,"b'Payday loans have a hidden cost: bank fees. Half of borrowers incur overdrafts, @CFPB says https://t.co/iuGdvngXY9'"
722853522404962304,2016-04-20 18:24:44,1,b'Sumner Redstone\xe2\x80\x99s granddaughter is now joining the battle over his mental competancy https://t.co/ClXUErJaoT'
722851844360433664,2016-04-20 18:18:04,3,b'The Senate this morning passed the first broad energy bill since the George W. Bush administration  https://t.co/YnrvKvVtQR'
722846814655918080,2016-04-20 17:58:05,9,"b""After a rough quarter, the questions are mounting over Goldman Sachs's direction  https://t.co/9aEHmrkW02 https://t.co/8NoyuA7PUd"""
722845558398984192,2016-04-20 17:53:05,7,"b'The ""Whole Foods effect"" is great for a business. Until it has to scale up. https://t.co/f6zFBFvl9z https://t.co/ECWFGQbJ3V'"
722841525777002497,2016-04-20 17:37:04,0,"b'Crystal City, once cast off by Washington, is rebooting itself https://t.co/sSDolksjgq https://t.co/LFWdmDPTbq'"
722839268163502080,2016-04-20 17:28:05,6,b'Mitsubishi admits it cheated on fuel-economy tests on a popular microcar sold in Japan. https://t.co/aflvbyQpB0 https://t.co/yKZoweihHN'
722832893337280512,2016-04-20 17:02:46,3,"b'Payday loans have a hidden cost: bank fees. Half of borrowers incur overdrafts, @CFPB says https://t.co/YC968IixdA'"
722829443912347649,2016-04-20 16:49:03,6,b'Customers and retailers may have one less reason to dislike new chip-enabled credit cards https://t.co/Ykll1SAFlj https://t.co/Tr4VObZs6o'
722826059067047937,2016-04-20 16:35:36,16,"b'Updated: Images of women are expected to grace the back of the new $10 bill, and the front of the $20  https://t.co/HrSg4MhrqZ'"
722825173422981120,2016-04-20 16:32:05,2,b'The purveyors of Cocoa Puffs and Slurpees are getting in on the VC game https://t.co/DH3hplrEj9'
722822641812422656,2016-04-20 16:22:01,5,b'\xe2\x80\x98Hamilton\xe2\x80\x99 mania expected to relegate women to the back of $10 bill  https://t.co/EWhQB9u7kU https://t.co/FUqhncl71a'
722821645841383424,2016-04-20 16:18:04,5,b'Mitsubishi admits it cheated on fuel-economy tests for a popular microcar sold in Japan. https://t.co/9Rzv6wNoIY https://t.co/ljE8vPUCOm'
722818872408219648,2016-04-20 16:07:03,6,"b'RT @Jeffrey_Cane: Chinese M&amp;A is far from dead: Today, a $3.6B deal for Lexmark.  https://t.co/xzVQm73SeN'"
722816607190454272,2016-04-20 15:58:03,6,"b""After a rough quarter, the questions are mounting over Goldman Sachs's direction  https://t.co/NA6Hb3sSOm https://t.co/0cuUV2Wdyh"""
722815863385141248,2016-04-20 15:55:05,9,"b'This #EarthDay, be an anti-consumer. Skip buying a new iPhone or Android with these tips. https://t.co/mat8aUC88H https://t.co/QWchFIeLwR'"
722815101296844801,2016-04-20 15:52:04,7,b'Consumer demand for local foods is driving these entrepreneurs. https://t.co/raTzXZIJUQ https://t.co/PnMjxykLtI'
722812096510062592,2016-04-20 15:40:07,9,b'Google was charged with breaking European antitrust rules with its use of Android https://t.co/xSoKn0cvgp https://t.co/RUji8bBnhC'
722810557024350208,2016-04-20 15:34:00,4,"b'RT @owlese: Payday loans are known for high rates &amp; fees, but they have a 2nd, less obvious cost. https://t.co/cJvArpj8Zv https://t.co/2eR6\xe2\x80\xa6'"
722808819391340544,2016-04-20 15:27:06,5,"b'Payday loans have a hidden cost: bank fees. Half of borrowers incur overdrafts, @CFPB says https://t.co/f1QWhbLE3W'"
722806740958515200,2016-04-20 15:18:50,4,b'The purveyors of Cocoa Puffs and Slurpees are getting in on the VC game https://t.co/Tc78EdlH0v'
722803783550558208,2016-04-20 15:07:05,3,b'A puzzling move as Senators Schumer and Warren hold up 2 regulatory nominees: https://t.co/vEFtQCjb7l'
722799253916106752,2016-04-20 14:49:05,2,b'Customers and retailers may have one less reason to dislike new chip-enabled credit cards https://t.co/tIOuZOiGJx https://t.co/BruSL0HNyH'
722795719145426944,2016-04-20 14:35:02,4,"b'Crystal City, once cast off by Washington, is rebooting itself https://t.co/ggLfKkKs9j https://t.co/GbshtQiG0f'"
722793963632140288,2016-04-20 14:28:04,5,b'Mitsubishi admits it cheated on fuel-economy tests on a popular microcar sold in Japan. https://t.co/f7PNeWYgNS https://t.co/Ipdmaoq3Kp'
722790517277384704,2016-04-20 14:14:22,3,b'A puzzling move as Senators Schumer and Warren hold up 2 regulatory nominees: https://t.co/bCkh609wGA'
722788677496254465,2016-04-20 14:07:04,8,"b'Bill Campbell, known as \xe2\x80\x9ccoach\xe2\x80\x9d to giants of tech world including Jobs and Page, dies at 75 https://t.co/llNkhrIQf0 https://t.co/UaABPXNZWS'"
722786421409492993,2016-04-20 13:58:06,11,"b'Intel, reeling from a collapse in demand for PCs, announced it would cut 12,000 jobs https://t.co/0IwuK6I1rt https://t.co/NeV16wWAKf'"
722785155920896000,2016-04-20 13:53:04,10,"b'The ""Whole Foods effect"" is great for a business. Until it has to scale up. https://t.co/n4SSMhgFPh https://t.co/5TrBWeSQjc'"
722783644838993920,2016-04-20 13:47:04,2,"b'RT @timrace: Visualizing the varieties of cannabinoid experience, as @markoff once again takes us to cyberspace and beyond.\n https://t.co/Q\xe2\x80\xa6'"
722781888813920256,2016-04-20 13:40:05,6,b'Google was charged with breaking European antitrust rules with its use of Android https://t.co/K5M2RmrFVT https://t.co/IQPE0T28BA'
